event                                     , date  , person                 , quote                                                                                                                                                                                                                                                                                                                                                                                                                                                                                                                                                                                                             , Annotator 1 Sentiment, Annotator 1 Group, Annotator 2 Sentiment, Annotator 2 Group, Annotator 3 Sentiment, Annotator 3 Group
2024 - WNBA FINALS: MINNESOTA VS. NEW YORK, 16-Oct, SABRINA IONESCU        , "And obviously like we don't win this game without Stewie. What she was able to do, just continued to chip away. Obviously she'll speak, but I mean, yeah, there's nothing I could say. Like that shot's nice but that doesn't go against what she's been able to do for us tonight and how she was able to just will us back into that game."                                                                                                                                                                                                                                                                    ,                      ,                  ,                      ,                  ,                      , 
2024 - WNBA FINALS: MINNESOTA VS. NEW YORK, 10-Oct, CATHY ENGELBERT        , "I think we do have standards, by the way, across the board for facilities, practice facilities and things like that. The owners now know that there's an edge to showing a player investment in the things like facilities, et cetera, especially practice facilities."                                                                                                                                                                                                                                                                                                                                          ,                      ,                  ,                      ,                  ,                      , 
2024 - NBA DRAFT                          , 26-Jun, MATAS BUZELIS          , "How do I feel it improved my game? Being around NBA coaches, veterans, just being in the NBA atmosphere, playing NBA rules and all that."                                                                                                                                                                                                                                                                                                                                                                                                                                                                        ,                      ,                  ,                      ,                  ,                      , 
2024 - NBA DRAFT                          , 26-Jun, AJ JOHNSON             , "Like I said before, it's just really truly a blessing to have players that you're really close with that are at the level that you want to be at and are doing the things that you want to do on the court. Just to have them to pick their brains and receive advice that they are giving me, I feel like it's truly a blessing."                                                                                                                                                                                                                                                                               ,                      ,                  ,                      ,                  ,                      , 
2024 - WNBA DRAFT                         , 15-Apr, JACY SHELDON           , "Yeah, I was there for a minute and I got to experience Buckeye Nation and just staying in Ohio, which was amazing. I think just the way we represented that university and the way they're going to continue to, it's an honor to put on that jersey every day, it's an honor to play in front of Buckeye Nation every night. I just hope that we left a legacy of hard work going out there every night and giving it our all."                                                                                                                                                                                 ,                      ,                  ,                      ,                  ,                      , 
2024 - NBA ALL-STAR RISING STARS PRACTICE , 16-Feb, CHET HOLMGREN          , """I can't believe I just did this."" I mean, getting into the NBA, being drafted, shaking Adam Silver's hand and finally playing in my first game. Obviously, there was a lot of time in between that, but those two moments were huge for me."                                                                                                                                                                                                                                                                                                                                                                  ,                      ,                  ,                      ,                  ,                      , 
2024 - NBA DRAFT                          , 26-Jun, DALTON KNECHT          , "It feels great, to play with one of the greats to ever touch a basketball. It's going to be exciting to go put on a show for L.A."                                                                                                                                                                                                                                                                                                                                                                                                                                                                               ,                      ,                  ,                      ,                  ,                      , 
2024 - WNBA FINALS: MINNESOTA VS. NEW YORK, 20-Oct, JONQUEL JONES          , "It really just means a lot to be able to win with her and to watch the way that she approaches the game every day. The way that she leads our team, because she is our leader and we look to her in tough moments. So it just really means a lot to have everything come together and to be able to win together."                                                                                                                                                                                                                                                                                               ,                      ,                  ,                      ,                  ,                      , 
2024 - WNBA DRAFT                         , 15-Apr, CATHY ENGELBERT        , "I think that's the way to add these roster spots for purposes of the game, as we've looked at the data. But we continue to monitor that for sure and talk with our players quite frankly about it, as well."                                                                                                                                                                                                                                                                                                                                                                                                     ,                      ,                  ,                      ,                  ,                      , 
2024 - NBA ALL-STAR RISING STARS PRACTICE , 16-Feb, CHET HOLMGREN          , "I mean, it's got to be MJ, I guess. I mean, he was the best."                                                                                                                                                                                                                                                                                                                                                                                                                                                                                                                                                    ,                      ,                  ,                      ,                  ,                      , 
2024 - ALL-STAR GAME                      , 18-Feb, TYRESE HALIBURTON      , "I think I've handled it pretty well, but just as professional athletes in general -- microphone interruption. My bad. I don't know what's going on up here."                                                                                                                                                                                                                                                                                                                                                                                                                                                     ,                      ,                  ,                      ,                  ,                      , 
2024 - ALL-STAR GAME                      , 18-Feb, STEPHEN CURRY          , You don't ever want to lose that joy no matter how deep you get into your career and the expectations that come with the success that you have and the standards you set. Things are going to get tougher when you try to win at the highest level. Embracing that while still playing with joy is always the challenge.                                                                                                                                                                                                                                                                                          ,                      ,                  ,                      ,                  ,                      , 
2024 - ALL-STAR GAME                      , 18-Feb, KEVIN DURANT           , "Me and Kawhi was in awe of them shooting from the three-point line like it was a free throw. That's strength, power, muscle memory. That's someone who works extremely hard every day on their craft to be able to do that without flinching. It was just normal and natural motion."                                                                                                                                                                                                                                                                                                                            ,                      ,                  ,                      ,                  ,                      , 
2024 - NBA ALL-STAR RISING STARS PRACTICE , 16-Feb, CHET HOLMGREN          , I'd say my post fade. I added it to my game a while back. I've had it in my game. It's a good shot for me. I feel like I should just get to it more.                                                                                                                                                                                                                                                                                                                                                                                                                                                              ,                      ,                  ,                      ,                  ,                      , 
2024 - ALL-STAR GAME                      , 18-Feb, GIANNIS ANTETOKOUNMPO  , "My philosophy is kind of drive them off the three. I think that's what we've been doing the last couple of years. Try to make them shoot a tough two. No layups. Protect the paint. We have a great Defensive Player of the Year candidate, Brook Lopez, on our team. Send as many people as you can to the paint. No easy layups. Whenever a guy is at the three-point line wide open, you've got to fly out to him and make him put the ball on the floor. If he's going to take a dribble, dribble, dribble three, the chance of that going in is better."                                                    ,                      ,                  ,                      ,                  ,                      , 
2024 - WNBA FINALS: MINNESOTA VS. NEW YORK, 18-Oct, CHERYL REEVE           , "Elite players play no matter the environment, home, road. Elite players play and they love the environment and they are not affected by the environment. That's why you see the series has been what it has, winning on each other's court."                                                                                                                                                                                                                                                                                                                                                                     ,                      ,                  ,                      ,                  ,                      , 
2024 - NBA ALL-STAR MEDIA DAY             , 17-Feb, GIANNIS ANTETOKOUNMPO  , "As I said, I don't watch a lot of basketball. I haven't watched him play a lot of the year, but obviously when we are in the bus or in the plane, you have guys going, oh, wow, that's crazy. Then it kind of draws your attention. It's like what happened? You want to know because I'm nosey, I want to know."                                                                                                                                                                                                                                                                                                ,                      ,                  ,                      ,                  ,                      , 
2024 - WNBA FINALS: MINNESOTA VS. NEW YORK, 18-Oct, CHERYL REEVE           , "For sure, for sure. I think as a league, we're kind of getting it, and our TV partner being a partner in the best of ways at this time. All of it. All of the investments."                                                                                                                                                                                                                                                                                                                                                                                                                                      ,                      ,                  ,                      ,                  ,                      , 
2024 - WNBA DRAFT                         , 15-Apr, ALISSA PILI            , "Definitely the community in Salt Lake City. I think it's really grown on me the last two years I was there, and I'm going to miss it a lot because even though I came from another Pac-12 school, they still took me with open arms and just supported me throughout everything."                                                                                                                                                                                                                                                                                                                                ,                      ,                  ,                      ,                  ,                      , 
2024 - NBA ALL-STAR RISING STARS PRACTICE , 16-Feb, PAOLO BANCHERO         , "I don't really know him too well, but he seems like a pretty smart guy who understands who he is. He's the number one pick, so they're counting on him to turn around the franchise, and I think he understands that. I think he understands the pressure that comes with it."                                                                                                                                                                                                                                                                                                                                   ,                      ,                  ,                      ,                  ,                      , 
2024 - NBA ALL-STAR MEDIA DAY             , 17-Feb, JAYSON TATUM           , "Would I love to win? Yes. But apparently us losing the Finals two years ago affects what people think of me now, so I guess I've got some ground to make up. Everybody who has a vote, they vote -- the criteria is different. Everybody thinks differently. Right, wrong, or indifferent, it is what it is. You can't tell people what they should look for when they vote. That's the beauty of it."                                                                                                                                                                                                           ,                      ,                  ,                      ,                  ,                      , 
2024 - WNBA FINALS: MINNESOTA VS. NEW YORK, 20-Oct, SANDY BRONDELLO        , So I kind of prepared Nyara in that regard and I'm very thankful that it worked well for us.                                                                                                                                                                                                                                                                                                                                                                                                                                                                                                                      ,                      ,                  ,                      ,                  ,                      , 
2024 - NBA DRAFT                          , 26-Jun, JARED McCAIN           , I'm just excited to embrace the challenge and embrace the process and have fun with it. It's a blessing to even be here.                                                                                                                                                                                                                                                                                                                                                                                                                                                                                          ,                      ,                  ,                      ,                  ,                      , 
2024 - WNBA FINALS: MINNESOTA VS. NEW YORK, 10-Oct, SANDY BRONDELLO        , "Yeah, look, I think they were throwing different coverages at her, with the switching and she was trying to go probably a little bit too much one-on-one early. We've just got to move the ball and trust that the ball will come back to her in that regard and exploit it."                                                                                                                                                                                                                                                                                                                                    ,                      ,                  ,                      ,                  ,                      , 
2024 - WNBA DRAFT                         , 15-Apr, CATHY ENGELBERT        , No specific comment on that specific city other than it's certainly on the list. I think it's a great basketball city. We'll continue to discuss it with ownership groups there that are interested in committing long term to the W.                                                                                                                                                                                                                                                                                                                                                                             ,                      ,                  ,                      ,                  ,                      , 
2024 - NBA ALL-STAR RISING STARS PRACTICE , 16-Feb, VICTOR WEMBANYAMA      , "I don't know. I'm probably going to keep that secret because I want to beat those guys in the season. Yeah, I'm going to keep that secret."                                                                                                                                                                                                                                                                                                                                                                                                                                                                      ,                      ,                  ,                      ,                  ,                      , 
2024 - NBA DRAFT                          , 26-Jun, ISAIAH COLLIER         , "I'm looking forward to playing with everybody, to be honest. I've heard a lot of great things about Utah. I'm just looking forward to learning a lot about it and living there."                                                                                                                                                                                                                                                                                                                                                                                                                                 ,                      ,                  ,                      ,                  ,                      , 
2024 - ALL-STAR GAME                      , 18-Feb, KARL-ANTHONY TOWNS     , "Just my teammates getting me the ball. Especially when you're a big, you never know what's going to happen. For my teammates to trust me and want to give me the ball was just an honor and a blessing."                                                                                                                                                                                                                                                                                                                                                                                                         ,                      ,                  ,                      ,                  ,                      , 
2024 - NBA ALL-STAR RISING STARS PRACTICE , 16-Feb, BONES HYLAND           , "Of course, yeah. I always set my goals for myself, and I knew I would be here. I'm just checking things off my checkbox. So it's been good for me."                                                                                                                                                                                                                                                                                                                                                                                                                                                              ,                      ,                  ,                      ,                  ,                      , 
2024 - WNBA FINALS: MINNESOTA VS. NEW YORK, 10-Oct, SANDY BRONDELLO        , "Yeah, look, I think they took us out of what we wanted to run. They were really aggressive. They were blowing up stuff. We couldn't get clear passes. We tried to go downhill and they would stunt and get back, and we just got a little bit stagnant. Then we had obviously -- I thought we were slow. We were up so you're trying to move the ball, but then we are slow in our speed, execution speed, and then it was making it easy for them."                                                                                                                                                             ,                      ,                  ,                      ,                  ,                      , 
2024 - WNBA FINALS: MINNESOTA VS. NEW YORK, 18-Oct, NAPHESSA COLLIER       , "I think we're excited. I don't even know if I'm thinking about that. I'm thinking that it's a Game 5 of the Finals, that we need to go out and execute. That's really all I'm thinking about."                                                                                                                                                                                                                                                                                                                                                                                                                   ,                      ,                  ,                      ,                  ,                      , 
2024 - NBA ALL-STAR RISING STARS PRACTICE , 16-Feb, BONES HYLAND           , I don't know. Enjoy my time off.                                                                                                                                                                                                                                                                                                                                                                                                                                                                                                                                                                                  ,                      ,                  ,                      ,                  ,                      , 
