event                                     , date  , person                 , quote                                                                                                                                                                                                                                                                                                                                                                                                                                                                                                                                                                                                             , Annotator 1 Sentiment, Annotator 1 Group, Annotator 2 Sentiment, Annotator 2 Group, Annotator 3 Sentiment, Annotator 3 Group
2024 - NBA ALL-STAR RISING STARS PRACTICE , 16-Feb, CHET HOLMGREN          , "It was only a matter of time before we figured out how to make that equate into wins. I'm just thankful to be out here with the group of guys that we've got, trying to win games. We've all bought into the winning mindset and doing what it takes to win. So far, it's been showing."                                                                                                                                                                                                                                                                                                                         ,                      ,                  ,                      ,                  ,                      , 
2024 - WNBA FINALS: MINNESOTA VS. NEW YORK, 10-Oct, NAPHEESA COLLIER       , "Just every game, I try to go out and impact defensively. Especially when they are going on a run like that, they have amazing offensive players, and so trying to be as disruptive as I can."                                                                                                                                                                                                                                                                                                                                                                                                                    ,                      ,                  ,                      ,                  ,                      , 
2024 - WNBA FINALS: MINNESOTA VS. NEW YORK, 20-Oct, NYARA SABALLY          , "I don't know if they are bragging rights. It's for my whole family, basically, specifically Satou. She's been with me every step of the way and has been in my corner through my ups and downs, and I've had a lot of downs in my career. This ring is for her as much as it is for me."                                                                                                                                                                                                                                                                                                                         ,                      ,                  ,                      ,                  ,                      , 
2024 - WNBA DRAFT                         , 15-Apr, CELESTE TAYLOR         , "Yeah, obviously very, very big defensive-minded kid, but at the same time, I'm willing to do whatever it is that a team needs me to do. I'm willing to come in there and impact. I'm really big on community. So just getting my hand in the community and continuing to be who I am and continuing to make an impact in every stop that I've had."                                                                                                                                                                                                                                                              ,                      ,                  ,                      ,                  ,                      , 
2024 - WNBA DRAFT                         , 15-Apr, CATHY ENGELBERT        , "So those are the types of things, but we have a variety of other things. You might have seen some that were at the NBA All-Star Game, how we stood up activations there, and Sabrina-Steph in the three-point competition obviously was a highlight of that weekend. Just continuing to have our player marketing agreement players that we're paying in the offseason to market on behalf of the W. We've got Aliyah Boston here today doing a lot of -- she obviously did an amazing job, I thought, on broadcast during the NCAA Tournament, as well."                                                        ,                      ,                  ,                      ,                  ,                      , 
2024 - WNBA DRAFT                         , 15-Apr, MARQUESHA DAVIS        , "I would say that makes it a little bit easier. Just coming in and having a certain role and knowing what's expected of you and knowing that you don't have to be the superhero or anything like that. So I would say that that would definitely make it a lot better or -- well, yeah, coming in, learning from those vets."                                                                                                                                                                                                                                                                                     ,                      ,                  ,                      ,                  ,                      , 
2024 - NBA ALL-STAR RISING STARS PRACTICE , 16-Feb, CHET HOLMGREN          , "Laughter. Probably like Embiid or somebody, just because he's huge."                                                                                                                                                                                                                                                                                                                                                                                                                                                                                                                                             ,                      ,                  ,                      ,                  ,                      , 
2024 - NBA DRAFT                          , 26-Jun, DaRON HOLMES II        , "It was pretty cool. Great to see those players and a lot of great talent in there. I'm just happy to be where I'm at. Perfect fit. I'm very excited. I was excited the whole time. A little nervous. Great to see all my boys there watching me, but it's just great to be here."                                                                                                                                                                                                                                                                                                                                ,                      ,                  ,                      ,                  ,                      , 
2024 - NBA DRAFT                          , 26-Jun, ALEX SARR              , "Yeah, it helped a lot. My dad, he always loved basketball and he looked at basketball -- he never was happy after one of my games. He always had something to say for me to improve on it. I think that's what made me and my brother good players. I can't thank them enough for this."                                                                                                                                                                                                                                                                                                                         ,                      ,                  ,                      ,                  ,                      , 
2024 - WNBA FINALS: MINNESOTA VS. NEW YORK, 13-Oct, SANDY BRONDELLO        , Okay. Kelly is coming.                                                                                                                                                                                                                                                                                                                                                                                                                                                                                                                                                                                            ,                      ,                  ,                      ,                  ,                      , 
2024 - ALL-STAR GAME                      , 18-Feb, SHAI GILGEOUS-ALEXANDER, "It was fun. I've said so many times you dream about it as a kid. When you get here, you think you're ready for it, but you're not."                                                                                                                                                                                                                                                                                                                                                                                                                                                                              ,                      ,                  ,                      ,                  ,                      , 
2024 - NBA ALL-STAR MEDIA DAY             , 17-Feb, TYRESE HALIBURTON      , "I'm trying to think. What comes to mind? Have you ever seen that commercial where the dude goes to the ref and says like, Coach, I touched this, their ball, and then the ref switches the call? Terrible. I don't know what brand that was, but that was awful."                                                                                                                                                                                                                                                                                                                                                ,                      ,                  ,                      ,                  ,                      , 
2024 - WNBA FINALS: MINNESOTA VS. NEW YORK, 20-Oct, SANDY BRONDELLO        , No practice.                                                                                                                                                                                                                                                                                                                                                                                                                                                                                                                                                                                                      ,                      ,                  ,                      ,                  ,                      , 
2024 - WNBA FINALS: MINNESOTA VS. NEW YORK, 18-Oct, BREANNA STEWART        , "In the playoffs, in a series, there's going to be momentum shifts. There were momentum shifts in the game tonight. But mentally, understanding what's our ultimate goal, how are things going right here. Like Sandy said in the locker room, we haven't won anything yet we haven't lost anything yet. And we have the opportunity to do that Sunday."                                                                                                                                                                                                                                                          ,                      ,                  ,                      ,                  ,                      , 
2024 - NBA ALL-STAR MEDIA DAY             , 17-Feb, KEVIN DURANT           , "Just being around the greats. Even if it's a couple minutes, you can soak up some type of knowledge from these guys. You just get so much energy seeing other greats, other Hall of Famers, all the other champions in the building with you. So to be in that atmosphere with them is probably the best part."                                                                                                                                                                                                                                                                                                  ,                      ,                  ,                      ,                  ,                      , 
2024 - WNBA FINALS: MINNESOTA VS. NEW YORK, 13-Oct, BREANNA STEWART        , "Absolutely. I think that the first thing was higher pick-up points, knowing that if Leo was going to be up, really trying to limit Courtney Williams, then I need to be there, too. So when Phee is dribbling up it's without any pressure."                                                                                                                                                                                                                                                                                                                                                                     ,                      ,                  ,                      ,                  ,                      , 
2024 - WNBA FINALS: MINNESOTA VS. NEW YORK, 10-Oct, CHERYL REEVE           , "I'm just happy she made a clutch free throw, if you go and look --"                                                                                                                                                                                                                                                                                                                                                                                                                                                                                                                                              ,                      ,                  ,                      ,                  ,                      , 
2024 - WNBA FINALS: MINNESOTA VS. NEW YORK, 20-Oct, BREANNA STEWART        , Can I say something? Thank you.                                                                                                                                                                                                                                                                                                                                                                                                                                                                                                                                                                                   ,                      ,                  ,                      ,                  ,                      , 
2024 - WNBA DRAFT                         , 15-Apr, ALISSA PILI            , "Yeah, I think they'll just get somebody who's a competitor and somebody who has a unique style of play and is just fun to watch."                                                                                                                                                                                                                                                                                                                                                                                                                                                                                ,                      ,                  ,                      ,                  ,                      , 
2024 - ALL-STAR GAME                      , 18-Feb, LeBRON JAMES           , "I've been asked about Victor before, and I just think he's going to continue to get better and better and better and better the more games he plays. He has one of the greatest coaches in basketball history in Coach Pop, and he's going to learn it the right way by just being around Pop. Pop is one of my favorite guys."                                                                                                                                                                                                                                                                                  ,                      ,                  ,                      ,                  ,                      , 
2024 - WNBA FINALS: MINNESOTA VS. NEW YORK, 18-Oct, BREANNA STEWART        , "I think that, you know, for our team, we bounce back after a loss really, really well, and making sure that everybody is on the same page going forward."                                                                                                                                                                                                                                                                                                                                                                                                                                                        ,                      ,                  ,                      ,                  ,                      , 
2024 - ALL-STAR GAME                      , 18-Feb, STEPHEN CURRY          , "It's a great visual to see. It's a great comparison of body movement, ball movement, between the two sports. It's all about just flow and rhythm and chemistry. We've had a certain style that we've mastered that has evolved over the ten years he's been coaching. Yeah, it was a concerted effort to get us to play a certain way that would help us win. Obviously we've been able to do that."                                                                                                                                                                                                             ,                      ,                  ,                      ,                  ,                      , 
2024 - ALL-STAR GAME                      , 18-Feb, DAMIAN LILLARD         , "Usually our preparation to get ready to compete, it looks a lot different than it looks when we come here. This weekend was a lot better than the past, but I think when the game is any type of loose, if it's not a game where you've got a scouting report and you're locked in and a lot is on the line, then guys who are too talented, are going to make a lot of threes. That's the kind of game it's going to be."                                                                                                                                                                                       ,                      ,                  ,                      ,                  ,                      , 
2024 - WNBA FINALS: MINNESOTA VS. NEW YORK, 13-Oct, SANDY BRONDELLO        , "Geno. Vivian, has been here for B. It's great."                                                                                                                                                                                                                                                                                                                                                                                                                                                                                                                                                                  ,                      ,                  ,                      ,                  ,                      , 
2024 - ALL-STAR GAME                      , 18-Feb, TYRESE HALIBURTON      , "I think the reason I've had success leading my franchise is the people around me and the trust that's put in me, it's a big responsibility for me, and I'm completely understanding of that. Yeah, just trying to do a good job with it."                                                                                                                                                                                                                                                                                                                                                                        ,                      ,                  ,                      ,                  ,                      , 
2024 - NBA ALL-STAR RISING STARS PRACTICE , 16-Feb, PAOLO BANCHERO         , "I didn't really realize what I did in the moment. But after the game, I just saw a clip and realized really what I did. It was crazy."                                                                                                                                                                                                                                                                                                                                                                                                                                                                           ,                      ,                  ,                      ,                  ,                      , 
2024 - WNBA DRAFT                         , 15-Apr, CATHY ENGELBERT        , "We'll continue to monitor the situation there, but our players won't run away from it. They'll want to help change and effect change, and we'll use our platform and their platform to do just that."                                                                                                                                                                                                                                                                                                                                                                                                            ,                      ,                  ,                      ,                  ,                      , 
2024 - ALL-STAR GAME                      , 18-Feb, DAMIAN LILLARD         , "I thought it was enough moments to be excited about and enjoy watching. But it was probably too much leak-out, go get a dunk, go get a layup type of moments. If we could limit those, people wouldn't feel the way they feel sometimes about it, if we could just try to limit it. It's going to happen sometimes, but it probably can't happen as much."                                                                                                                                                                                                                                                       ,                      ,                  ,                      ,                  ,                      , 
2024 - NBA DRAFT                          , 26-Jun, TRISTAN DA SILVA       , "I talked with him earlier today, or tonight. I'm super excited, just learning from one of the great coaches. I feel like there's a lot that I can expand my game in, and I can't wait to learn even more. I feel like talking basketball and talking basketball IQ is one of my passions, as well, in the game. I'm just super excited to soak up all that knowledge and kind of grow."                                                                                                                                                                                                                          ,                      ,                  ,                      ,                  ,                      , 
2024 - NBA DRAFT                          , 26-Jun, DONOVAN CLINGAN        , It's a great feeling. You dream of this moment your whole life. You watch it on TV every single year. To have that moment here in front of you today and to hear my name called is something that I'll remember for the rest of my life.                                                                                                                                                                                                                                                                                                                                                                          ,                      ,                  ,                      ,                  ,                      , 
2024 - NBA ALL-STAR MEDIA DAY             , 17-Feb, TYRESE HALIBURTON      , "It means the world. It means the world. I think the respect that I've gained from my peers and legends means the world to me. Just to keep meeting people where I'm from, that's not really a thing. There's no chance that they even know where Oshkosh, Wisconsin, is."                                                                                                                                                                                                                                                                                                                                        ,                      ,                  ,                      ,                  ,                      , 
2024 - NBA ALL-STAR MEDIA DAY             , 17-Feb, GIANNIS ANTETOKOUNMPO  , "So, yeah, be a hard worker, don't give up, believe in yourself."                                                                                                                                                                                                                                                                                                                                                                                                                                                                                                                                                 ,                      ,                  ,                      ,                  ,                      , 
