event                                     , date  , person                 , quote                                                                                                                                                                                                                                                                                                                                                                                                                                                                                                                                                                                                             , Annotator 1 Sentiment, Annotator 1 Group, Annotator 2 Sentiment, Annotator 2 Group, Annotator 3 Sentiment, Annotator 3 Group
2024 - NBA DRAFT                          , 26-Jun, BUB CARRINGTON         , "Probably say he'll be at the first game, and ""Don't suck."" Something he would probably say to me."                                                                                                                                                                                                                                                                                                                                                                                                                                                                                                             ,                    1  ,       0           ,                      ,                  ,                      , 
2024 - WNBA FINALS: MINNESOTA VS. NEW YORK, 13-Oct, SANDY BRONDELLO        , SABRINA IONESCU Go Ducks.                                                                                                                                                                                                                                                                                                                                                                                                                                                                                                                                                                                         ,                    1  ,       1           ,                      ,                  ,                      , 
2024 - WNBA FINALS: MINNESOTA VS. NEW YORK, 18-Oct, CHERYL REEVE           , And obviously I appreciate the opportunity that A Bar of Their Own has given women in making that front and center. I'm happy to support a woman-owned business like that.                                                                                                                                                                                                                                                                                                                                                                                                                                        ,             1         ,           0       ,                      ,                  ,                      , 
2024 - NBA DRAFT                          , 26-Jun, ZACCHARIE RISACHER     , "That's amazing. We are trying to represent our country, and I'm so glad to be a part of it. There is more players coming in. I'm really proud of being a part of the success of my country. Trying to understand what Victor, Rudy or other French players really help me to develop myself as a player, first of all, in France, and hopefully now in the NBA."                                                                                                                                                                                                                                                 ,              1        ,            0      ,                      ,                  ,                      , 
2024 - NBA DRAFT                          , 26-Jun, TIDJANE SALAUN         , "I think the basketball in France has improved, and that's why we are here in this draft. Three French players in the top 10, it's not nothing."                                                                                                                                                                                                                                                                                                                                                                                                                                                                  ,                 1     ,         1         ,                      ,                  ,                      , 
2024 - WNBA DRAFT                         , 15-Apr, NYADIEW PUOCH          , "Yeah, well, growing up in juniors, I'd always be the scorer, attacking the rim, being an offensive player and stuff. But as I headed into the pro league, being young, there's already people doing all that. You have to make sacrifices. You need to learn the game a bit more, learn your other strengths. For me, it was defense. My length, being able to guard different positions, different players, being able to switch on to different people and just using my length, my ability, my quickness to kind of get around people."                                                                       ,                  1    ,       0           ,                      ,                  ,                      , 
2024 - WNBA FINALS: MINNESOTA VS. NEW YORK, 13-Oct, BREANNA STEWART        , "But throughout this entire process, my team has my back every step of the way and was just excited to have another opportunity to go to battle with them. Because we have a lot of fun in everything that we do, and you know, it's not always like that."                                                                                                                                                                                                                                                                                                                                                       ,                  1    ,          1        ,                      ,                  ,                      , 
2024 - ALL-STAR GAME                      , 18-Feb, JAYLEN BROWN           , I didn't get a chance to meet him. He came in and said some words to us as a group. He kind of like said hello to everybody. We didn't get a chance to really communicate or talk. But it was great. That was my first time ever seeing him up close and personal. I haven't seen him around Boston or anything. It was pretty cool to see him around.                                                                                                                                                                                                                                                            ,                   1   ,        0          ,                      ,                  ,                      , 
2024 - NBA ALL-STAR RISING STARS PRACTICE , 16-Feb, PAOLO BANCHERO         , "Yeah, yeah. We feel like we can beat anybody on any given night. We're talented enough to do it, and it's just up to us bringing that same mentality. Yeah, it's encouraging when you know that you can compete with any team in the NBA."                                                                                                                                                                                                                                                                                                                                                                       ,               1       ,         1         ,                      ,                  ,                      , 
2024 - WNBA FINALS: MINNESOTA VS. NEW YORK, 20-Oct, KAYLA McBRIDE          , "I'm always so in awe of Phee because she carries it with such grace. She carries it her own way. As a superstar in this league, it can become about something else. But she always keeps it about the team and always keeps it about winning and continuing to get better and better."                                                                                                                                                                                                                                                                                                                           ,               1       ,          0        ,                      ,                  ,                      , 
2024 - WNBA FINALS: MINNESOTA VS. NEW YORK, 20-Oct, SANDY BRONDELLO        , Definitely. I think we need to have a parade in the Bahamas. Let's go!                                                                                                                                                                                                                                                                                                                                                                                                                                                                                                                                            ,                   1   ,        1          ,                      ,                  ,                      , 
2024 - ALL-STAR GAME                      , 18-Feb, JAYLEN BROWN           , "I've only been to a few. The only one I really can compare it to was Utah, because in Atlanta, the other one I went to, was COVID or whatever the case may be. So far, so good for me. I thought that was a great crowd, great energy. Turned out well."                                                                                                                                                                                                                                                                                                                                                         ,                   1   ,          0        ,                      ,                  ,                      , 
2024 - WNBA FINALS: MINNESOTA VS. NEW YORK, 10-Oct, CHERYL REEVE           , We are the first team in WNBA playoff history to be down 15 and come back and win the game. So that ranks really high.                                                                                                                                                                                                                                                                                                                                                                                                                                                                                            ,                 1     ,                1  ,                      ,                  ,                      , 
2024 - WNBA FINALS: MINNESOTA VS. NEW YORK, 20-Oct, CHERYL REEVE           , "It's disappointing. It's incredibly disappointing. But these guys, I mean, they've got to try to pick themselves up and go, ""We were that damn close."" It hurts. It hurts."                                                                                                                                                                                                                                                                                                                                                                                                                                    ,                  0    ,       1           ,                      ,                  ,                      , 
2024 - NBA ALL-STAR RISING STARS PRACTICE , 16-Feb, TREY MURPHY III        , "That's definitely part of it. I feel like it started even in preseason. One of the first games I was back, I had 27 against the Spurs, and that was one of the times where I was, like, all right, I'm ready and prepared. I just kept that confidence, kept the same energy. Just stuck with my consistent work and just tried to produce."                                                                                                                                                                                                                                                                     ,                      ,                  ,                      ,                  ,                      , 
2024 - WNBA DRAFT                         , 15-Apr, CATHY ENGELBERT        , "I thought it was clever, and Arike and Stewie did an amazing job. But this was an investment in bringing that NCAA viewer into the WNBA, and we hadn't done it before."                                                                                                                                                                                                                                                                                                                                                                                                                                          ,                      ,                  ,                      ,                  ,                      , 
2024 - WNBA DRAFT                         , 15-Apr, JACY SHELDON           , "I'm excited. I've seen the growth. Everyone has seen the growth, and to be a part of that is something that is really rare, so I'm looking forward to it."                                                                                                                                                                                                                                                                                                                                                                                                                                                       ,                      ,                  ,                      ,                  ,                      , 
2024 - WNBA FINALS: MINNESOTA VS. NEW YORK, 13-Oct, SANDY BRONDELLO        , "We talk about her being a rookie. She's not really a rookie. She has this experience in really big moments and the mindset to handle this atmosphere extremely well, and to make a play like that, I mean, I love it. She's an amazing player and an amazing human being."                                                                                                                                                                                                                                                                                                                                       ,                      ,                  ,                      ,                  ,                      , 
2024 - ALL-STAR GAME                      , 18-Feb, GIANNIS ANTETOKOUNMPO  , "Going through the streets of Lagos trying to buy a Giannis jersey. I told my mom, if I see my jersey, I'm going to stop and buy it. I don't care if people mob me. I've never bought my jersey before. It's a good way to do it."                                                                                                                                                                                                                                                                                                                                                                                ,                      ,                  ,                      ,                  ,                      , 
2024 - NBA DRAFT                          , 26-Jun, DONOVAN CLINGAN        , "Yeah, it's been a crazy two years, from winning one national title to winning the Big East regular season to the Big East Tournament and then winning another national title. A lot of winning, a lot of succeeding the past two years. I feel like I'm going to keep that chip on my shoulder and go into Portland with just a lot of confidence, with a willingness to learn and get better every single day."                                                                                                                                                                                                 ,                      ,                  ,                      ,                  ,                      , 
2024 - WNBA DRAFT                         , 15-Apr, ELIZABETH KITLEY       , "Yeah, honestly I'm thrilled. I can't think of a better situation to be in with the situation that my leg is in, because it's just an incredible fit. I think their resources are amazing, their facilities are awesome. To be able to look up to the players there, to be able to watch A'ja Wilson, even though I can't play, I know I'll be able to learn so much and get better just by watching and being around the culture that's there."                                                                                                                                                                  ,                      ,                  ,                      ,                  ,                      , 
2024 - ALL-STAR GAME                      , 18-Feb, JAYSON TATUM           , "So this time this weekend is for obviously yourself, but to bring your friends, families, partners, or whatever it may be to this event, to this weekend because there's a lot of activities and things like that, and there's just memories. Memories that build with the people who essentially help you get to this moment."                                                                                                                                                                                                                                                                                  ,                      ,                  ,                      ,                  ,                      , 
2024 - NBA DRAFT                          , 26-Jun, ZACCHARIE RISACHER     , "So I don't know yet, but I know that I can do a lot of things. Defend multiple positions, grabbing some rebounds, finishing strong, being aggressive, shooting threes obviously. I think that's going to be -- that's a part of my game. That's something that I need to keep it up for helping the team to win the next season, because I know that we are going to have to shoot the ball. And that's it."                                                                                                                                                                                                     ,                      ,                  ,                      ,                  ,                      , 
2024 - NBA ALL-STAR MEDIA DAY             , 17-Feb, SHAI GILGEOUS-ALEXANDER, "But we have no ceiling on what we think we can do this year. We kind of take the same mentality and just stay in the moment, plug away every day. Where we get at the end of the year, whenever the end of our season is, we'll look back and make adjustments and try to figure out then. As of right now, we just try to stay focused on the task at hand."                                                                                                                                                                                                                                                    ,                      ,                  ,                      ,                  ,                      , 
2024 - WNBA FINALS: MINNESOTA VS. NEW YORK, 16-Oct, BREANNA STEWART        , "They were up and their shots weren't falling. We were getting good looks, and it's like, if we are going to be this close, we are not leaving here without this win. It's tough to play in this arena, but the way that we continued to stay together is something that I'm not shocked at but I am really proud of."                                                                                                                                                                                                                                                                                            ,                      ,                  ,                      ,                  ,                      , 
2024 - WNBA FINALS: MINNESOTA VS. NEW YORK, 16-Oct, BREANNA STEWART        , "Just continuing to kind of be in help side and know that we did some different schemes. We sometimes were sending two to the ball and then leaving somebody open and making sure that, you know, between JJ and I, like we are going to protect the rim at all costs and make sure that nothing is easy, because this is the Finals and everything is going to be tough and we're going to make everybody work for it."                                                                                                                                                                                          ,                      ,                  ,                      ,                  ,                      , 
2024 - WNBA FINALS: MINNESOTA VS. NEW YORK, 10-Oct, CATHY ENGELBERT        , "We're looking at it from all these angles, partnerships, ranks of our employee base and certainly the coaching diversity and coaching, as well. So it is important to us. There's not a Board of Governors meeting that we don't talk about this. As you know, we've made enormous progress especially in the assistant coaching ranks with former WNBA players by essentially focusing on this over the last couple years. Made enormous progress, which is why our report card is really good."                                                                                                                ,                      ,                  ,                      ,                  ,                      , 
2024 - WNBA FINALS: MINNESOTA VS. NEW YORK, 20-Oct, BREANNA STEWART        , "Seven, nice. Hopefully we have more time."                                                                                                                                                                                                                                                                                                                                                                                                                                                                                                                                                                       ,                      ,                  ,                      ,                  ,                      , 
2024 - WNBA FINALS: MINNESOTA VS. NEW YORK, 20-Oct, NYARA SABALLY          , "Yeah, I mean, it's really just the -- thinking in German, sorry."                                                                                                                                                                                                                                                                                                                                                                                                                                                                                                                                                ,                      ,                  ,                      ,                  ,                      , 
2024 - NBA DRAFT                          , 26-Jun, AJ JOHNSON             , "No, a hundred percent. I'm super proud of myself just sticking through that Australian season, knowing things were not going my way but continue to believe in myself every single day, and keep taking steps and getting better and looking at the bigger picture of my career. I feel like it's a great experience of being out there."                                                                                                                                                                                                                                                                        ,                      ,                  ,                      ,                  ,                      , 
2024 - NBA ALL-STAR MEDIA DAY             , 17-Feb, JAYSON TATUM           , "Absolutely. And I think the league is in a great place right now, the amount of high-character guys, the amount of talent throughout the NBA. The fact that LeBron and KD and Steph are still considered one of the best 10 players in the league right now at their age and how long they've been playing is incredible."                                                                                                                                                                                                                                                                                       ,                      ,                  ,                      ,                  ,                      , 
2024 - ALL-STAR GAME                      , 18-Feb, GIANNIS ANTETOKOUNMPO  , "I don't know if I felt it. Maybe I did feel it a couple times. I don't know that I felt I had to lift and put Milwaukee on the map. I was just playing hard, doing what I love, being consistent with it, staying humble through the whole journey. I always wanted to get better."                                                                                                                                                                                                                                                                                                                              ,                      ,                  ,                      ,                  ,                      , 
