event,date,person,quote
2024 - ALL-STAR GAME,February 18,LEBRON JAMES,"My mind is just sharper than anything. It's allowed me to go out there and sometimes just outthink the game and not have to physically be imposing out on the floor for 40 minutes or 42, whatever the case may be that I'm out there. I could pick my spots."
2024 - ALL-STAR GAME,February 18,LEBRON JAMES,"I guess each team is going to dictate what your defense allows you to do or what you want to take away. At the end of the day, we're All NBA players, and you can't take away everything. Guys are going to score, guys are going to shoot threes, guys are going to put up numbers. It's what you're willing to give up, not what you want to take away."
2024 - ALL-STAR GAME,February 18,LEBRON JAMES,"Every team is different. Every team's portfolio is different of how they attack the game. If you do your scouting, if you do your research, you know players' tendencies, you can be proactive more than reactive."
2024 - WNBA DRAFT,April 15,ANGEL REESE,"My conversations were great with T Spoon. As you know, she was coached by Coach Mulkey, so I kind of thought maybe I'll go there. Knowing like the conversations were so good and she felt like a mother to me. Being able to be a Black woman and as a head coach, and everything she's done at the NBA level, I just knew everything they were bringing to the table."
2024 - NBA ALL-STAR RISING STARS PRACTICE,February 16,PAOLO BANCHERO,"Obviously, I know how my size is an advantage. So I don't want to get too much into staying on the perimeter. I want to be able to mix it up and always keep the defense off balance. That's something that I think me, my coaches, we always try to balance and work on is how much I'm handling, how much I'm inside and just trying to find that perfect balance."
2024 - WNBA FINALS: MINNESOTA VS. NEW YORK,October 10,SANDY BRONDELLO,But they went to another level. So they kind of took us out of a rhythm. Not surprised us. We knew what they are capable of doing. But we've got to get back and just play Liberty basketball.
2024 - WNBA FINALS: MINNESOTA VS. NEW YORK,October 20,CHERYL REEVE,"Just like our 2016 championship that was lost -- officiating, missing a shot clock violation. This sucks. This is for a championship for both teams. Let them decide it. What contact is legal should be the same for both teams. This isn't that hard."
2024 - ALL-STAR GAME,February 18,DAMIAN LILLARD,"Trying to manage everybody, trying to protect yourself and not get injured and take away from what you ultimately want to accomplish, I think is something we prioritize. But it's a lot that goes on when you come here for this game."
2024 - WNBA FINALS: MINNESOTA VS. NEW YORK,October 10,BREANNA STEWART,"We just take it on the chin, you know. We were up a lot and then we had a wild kind of sequence to end the fourth. Didn't start overtime great. I had a great look at the end and I didn't make it."
2024 - WNBA FINALS: MINNESOTA VS. NEW YORK,October 20,CHERYL REEVE,"So I tell these guys, for whatever reason, it didn't work out. It just doesn't feel right that you lose a series with that level of discrepancy. We don't have a team that whines and complains and all that stuff. Sometimes it probably hurts us. Maybe being a little more, I don't know, something. But you have a star player like Phee, that just, I don't get it. I don't get how she can be held and go to the basket and get hit, and then a marginal, at best, at best, sends their best player to the free throw line. I mean, that's tough. It's tough to swallow."
2024 - NBA DRAFT,June 26,PACOME DADIET,"Yeah, it's kind of crazy. I played with everybody. It's nice seeing your country being one of the most represented in the NBA. I'm proud of myself. I'm proud of everybody. The French people that went to the NBA, it's big. It's coming from a different continent. We have to really work to get there. Yeah, I'm really proud of everybody."
2024 - WNBA FINALS: MINNESOTA VS. NEW YORK,October 10,CATHY ENGELBERT,"I look forward to building the future of the league and sitting down with the players. Whether they opt out, not opt out. I suspect that given the transformation of the league that we've been working so hard on, building this long-term economic model, we've already returned to the players through charter, through increasing playoff bonuses a couple years ago by over 50 percent. So we'll continue to do that, and when we get to the bargaining table we'll continue to talk about the issues that are most important to the players."
2024 - WNBA DRAFT,April 15,CATHY ENGELBERT,"Right, so obviously one of our focuses this year of our social justice council is reproductive rights, as well as civic engagement, given that we're in a general election year. So the one thing I like about our players, our players want to be engaged. They don't run away from things. They want to be engaged and they want to force change in the communities in which they live and work, and they do it very, very effectively. I think on this issue they'll continue to do that effectively."
2024 - WNBA FINALS: MINNESOTA VS. NEW YORK,October 20,BREANNA STEWART,"But if they are not falling, they are not falling. I'm not going to let that affect the way I do things. So continuing to be there for my team. I didn't talk about this, but before I made the free throws, I missed two free throws. I was like, no, I can't do this again, I can't. I have to be here. Olaf Lange, him and I have talked about being a python, where it's like you know your moment when to strike. At that moment, I was just thinking about being a python."
2024 - WNBA DRAFT,April 15,KAMILLA CARDOSO,"I got really emotional because the main goal was to get here and being able to give my family a better life, and just by looking at them and seeing them at my table was amazing. I obviously get emotional when I talk about my family because I'm so proud of everything I was able to accomplish and do for them."
2024 - WNBA FINALS: MINNESOTA VS. NEW YORK,October 16,SABRINA IONESCU,"Yeah, I mean, I didn't even really remember it. I had to go look at the video really quickly to see like how far I was."
2024 - WNBA FINALS: MINNESOTA VS. NEW YORK,October 10,CHERYL REEVE,"No, it is the margin. It is the margin. But I hear what you're saying, in that when it mattered, we got some hustle plays. And we always say, you never know which one is going to be the difference between winning and losing."
2024 - NBA DRAFT,June 26,JA'KOBE WALTER,"Yeah, I think the more I develop, I'll definitely be able to initiate offense at the one. Played two and three before. I think playing in the NBA, playing around in practice, I think I'll start to get used to it more, and then I think I can really take that role to the next level."
2024 - NBA DRAFT,June 26,NIKOLA TOPIC,"He just told me, ""Welcome, teammate."" That means a lot for me because he accepted me. He stood up to shake my hand. It's really great to have him there. He's coming into the third year, and he's done a really good job the past two. And not just him, the players and the whole organization. I think we can do more."
2024 - WNBA FINALS: MINNESOTA VS. NEW YORK,October 20,CHERYL REEVE,It's a shame that officiating had such a hand in a series like this. Obviously there's always going to be a team that's going to be a little more disappointed than the other.
2024 - WNBA FINALS: MINNESOTA VS. NEW YORK,October 20,THE MODERATOR,"There's no practice tomorrow, so...."
2024 - NBA ALL-STAR RISING STARS PRACTICE,February 16,CHET HOLMGREN,"It was only a matter of time before we figured out how to make that equate into wins. I'm just thankful to be out here with the group of guys that we've got, trying to win games. We've all bought into the winning mindset and doing what it takes to win. So far, it's been showing."
2024 - NBA ALL-STAR MEDIA DAY,February 17,GIANNIS ANTETOKOUNMPO,Be patient. You've got to be patient. They're not always going to do things that you like. Be patient because they're kids. I think that's the most important thing.
2024 - ALL-STAR GAME,February 18,DAMIAN LILLARD,"I think 200 is a lot to be scored. It just shows that we didn't go out there and compete like I guess you would want us to or whoever would want us to. But I think that's just what it is. Guys are talented. Make a lot of shots. We hit a lot of threes, and that was it."
2024 - NBA ALL-STAR RISING STARS PRACTICE,February 16,TREY MURPHY III,"Always. That was always my motto. Just be patient and be myself and continue to work hard every single day. That's the best way to do it because if you don't, you try to rush the process, things aren't going to go your way."
2024 - NBA ALL-STAR MEDIA DAY,February 17,SHAI GILGEOUS-ALEXANDER,"To this point, it's not any harder, because I've grown through it being hard, I think, in the past."
2024 - WNBA FINALS: MINNESOTA VS. NEW YORK,October 16,SANDY BRONDELLO,Thank you.
2024 - WNBA DRAFT,April 15,CATHY ENGELBERT,"Lastly, I have been very reflective over the past couple weeks with all the hype and talk about this draft class and the WNBA. Surviving the existential time of the WNBA wubble, raising that 75 million in capital in February of 2022 as the first women's sports league to do so at that scale, deploying it against our key priorities. Almost as if we knew we had to be ready for this moment, and we are."
2024 - ALL-STAR GAME,February 18,KEVIN DURANT,"It's always been that way with NBA, and since the social media era, you see more and more of that. I think guys in the past have stood up for what they believe in, social issues in the league, and that's given us the confidence to go out and do it as well in this generation."
2024 - WNBA FINALS: MINNESOTA VS. NEW YORK,October 18,SANDY BRONDELLO,"But in the end, close game. Things we could have done better. We all could have done better. Including me, getting that expletive timeout -- excuse me, don't repeat it."
