event,date,person,quote
2024 - NBA DRAFT,June 26,DALTON KNECHT,"Yeah, I would say to all the kids out there that don't have offers, you don't have to be the highest-rated kid in your class or whatever. You could always go junior college or whatever type of route and be different. You can make your own path and find your way."
2024 - NBA DRAFT,June 26,DALTON KNECHT,"It feels great, to play with one of the greats to ever touch a basketball. It's going to be exciting to go put on a show for L.A."
2024 - NBA DRAFT,June 26,DALTON KNECHT,"Yeah, like you said, AD is there. I get to learn from one of the greatest in LeBron and AD to help me each step of the way on both sides of the floor. I'm excited just to go out there and compete."
2024 - NBA DRAFT,June 26,DALTON KNECHT,"Learning how to take care of my body constantly. I would say that's the biggest thing I was focusing on, and just kind of being around those type of NBA guys that have been there and done that. So just kind of learning from them."
2024 - NBA DRAFT,June 26,DALTON KNECHT,"I would say it's a mixture. I was just trying to be the best version of myself, and try to always push myself to be better and be better than yesterday."
2024 - NBA DRAFT,June 26,DALTON KNECHT,"Yeah, I remember that clip. I woke up and rolled out of bed and I thought it was fake because tons of people were texting me. I was just like, there's no way."
2024 - NBA DRAFT,June 26,DALTON KNECHT,"Yeah, that's really exciting. At Tennessee, I watched a lot of JJ Redick with Coach Barnes. Just the way he moves and paces himself, and was able to create space. So hearing that, it's going to be really exciting and really special."
2024 - NBA DRAFT,June 26,DALTON KNECHT,"I would just say playing with a chip on my shoulder. Every single time I touch a basketball or walk into a gym, I always feel like I've got something to prove."
2024 - NBA DRAFT,June 26,DALTON KNECHT,"It doesn't matter where I'm at. It's always going to be there, having that chip on my shoulder, feeling like I've been underrated for my whole life. It's something I'm going to carry with me the rest of my career."
2024 - NBA DRAFT,June 26,AJ JOHNSON,"A hundred percent. I feel like there's no feeling like it. Just having all the people that have been a part of your journey since the beginning and seeing you grow. I feel like there's nothing like having them here with me and experiencing this with me and supporting me. There's no feeling like it, honestly."
2024 - NBA DRAFT,June 26,AJ JOHNSON,"No, a hundred percent. I'm super proud of myself just sticking through that Australian season, knowing things were not going my way but continue to believe in myself every single day, and keep taking steps and getting better and looking at the bigger picture of my career. I feel like it's a great experience of being out there."
2024 - NBA DRAFT,June 26,AJ JOHNSON,"I feel like Milwaukee was one of my best workouts I had. Even in the interviews at the combine and stuff like that, the interviews went really well. They just seemed like they had my best interests and they really liked me. So yeah, I kind of felt a little bit like Milwaukee would be the team that would want me."
2024 - NBA DRAFT,June 26,AJ JOHNSON,"I would say that you just got to sometimes really just pop out and just show people, for real. You've just got to not want to duck or be scared. Believe in yourself more than anything and show people all the hard work that you've been putting in and the vision that you see and just put it out there."
2024 - NBA DRAFT,June 26,AJ JOHNSON,"I feel like him coming in the tenth game of the season for us as a team and giving us a lot of freedom and a lot of trust, I feel like it really helped our team as a whole just play better in general with the players we had. He was a big part of our team's success, for sure."
2024 - NBA DRAFT,June 26,AJ JOHNSON,There's no feeling like it. It's surreal to me. Trying to soak it in. But it's truly a blessing.
2024 - NBA DRAFT,June 26,AJ JOHNSON,"Like I said before, it's just really truly a blessing to have players that you're really close with that are at the level that you want to be at and are doing the things that you want to do on the court. Just to have them to pick their brains and receive advice that they are giving me, I feel like it's truly a blessing."
2024 - NBA DRAFT,June 26,DaRON HOLMES II,"Yeah, it's all in the process there. The coaches there, the people are just amazing. Dayton does a great job of giving you the right pathway. It's all up to you if you choose to believe in that or not."
2024 - NBA DRAFT,June 26,DaRON HOLMES II,"So they did that with me, Toumani Camara, Obi Toppin and all the guys before that. I decided to choose and I believe in it, and I'm here where I am now because of that. Very grateful for them."
2024 - NBA DRAFT,June 26,DaRON HOLMES II,"It was pretty cool. Great to see those players and a lot of great talent in there. I'm just happy to be where I'm at. Perfect fit. I'm very excited. I was excited the whole time. A little nervous. Great to see all my boys there watching me, but it's just great to be here."
2024 - NBA DRAFT,June 26,DaRON HOLMES II,"Oh, yeah, that's perfect. Great fit. I saw something that I get free nuggets from Wendy's. That's pretty cool. Other than that, I'm excited to get out there and play. It's a great team and a great organization for a reason. I'm going to get better and keep going."
2024 - NBA DRAFT,June 26,DaRON HOLMES II,"Probably an inhaler because I heard that -- what's it called, the altitude? I'm playing. I'll be all right."
2024 - NBA DRAFT,June 26,DaRON HOLMES II,"Honestly, I don't know. I'm just going to embrace it all and just be ready for it. I'm excited."
2024 - NBA DRAFT,June 26,RON HOLLAND II,"It means a lot coming from that program. Knowing that program just got shut down and I was the last bunch of that. Definitely taught me a lot on and off the court, really a lot of the things about life and being mentally healthy and just learning how the NBA operates."
2024 - NBA DRAFT,June 26,RON HOLLAND II,"On the court, this might be surprising to say, but all the losing that we did, I definitely learned a lot more than if we would have won a lot. I think that definitely prepared me a lot for the NBA because you're going to go through a lot of things with the NBA. It's going to be a lot of things that you need to be able to talk about or just have an outlet to and just being able to figure things out quickly just to move on to the next."
2024 - NBA DRAFT,June 26,RON HOLLAND II,"I'm looking forward to changing things around. I know they have a stigma on them when it comes to a lot of losing, and I feel like I'm a huge part to be able to start to change that around. I have a willingness to win and I feel like me going into this franchise, being able to help them out with this good group of guys, good group of young guys that they have, I'm definitely super excited to get down there and get to work."
2024 - NBA DRAFT,June 26,RON HOLLAND II,"I appreciate all the love and support you've given me throughout the whole season, and I'm finally here and I wouldn't be here without y'all."
2024 - NBA DRAFT,June 26,RON HOLLAND II,"Like I said, I really appreciate all the love and support and all the competitive people in the G League. I appreciate y'all. It was a huge honor being able to play, going straight out of high school. I'm definitely blessed and honored to be in the situation I'm in."
2024 - NBA DRAFT,June 26,RON HOLLAND II,"What excites me is really the basketball portion of it, for sure. I heard you have a huge fan base when it comes to basketball, so that's definitely something I'm looking forward to getting into. I'm a huge community guy, so I definitely see myself getting into that community as well."
2024 - NBA DRAFT,June 26,RON HOLLAND II,"I would say just talk to everybody that has been with me throughout this whole process and really sit down and tell them how thankful I am for that. I've been through so much. Just being able to be here, blessed with this opportunity God has put me in. I'm super thankful for everyone who has been part of my journey."
2024 - NBA DRAFT,June 26,RON HOLLAND II,"Once I tell them that, everything will be said and done and I'll be on my way to Detroit, and get settled in and have a good one."
2024 - NBA DRAFT,June 26,RON HOLLAND II,"Super proud of Matas. Knowing the role we had to take up on Ignite and meeting him throughout high school and being able to play against him and with him in the Ignite season, first of all, I'm super proud of him just knowing and seeing the man that he is becoming. I'm really super excited to see where his NBA career goes and super excited to compete against him as well."
2024 - NBA DRAFT,June 26,RON HOLLAND II,"That's going to go a long way. That's going to be super exciting matchups here in the future soon. Like I said, I'm just super proud of him and I'm super excited for him."
2024 - NBA DRAFT,June 26,KYSHAWN GEORGE,Just enjoying the moment with my family and grateful and very happy that my name got called.
2024 - NBA DRAFT,June 26,KYSHAWN GEORGE,"I mean, great. I think I can bring a lot to this team with my versatility, my size, my length, my IQ and my shooting ability. I think I will fit in very well."
2024 - NBA DRAFT,June 26,KYSHAWN GEORGE,"They are expecting hard work. Obviously, I can provide that. Just overall, like I said before, my versatility, shooting ability, spacing the floor and how smart I am with the ball."
2024 - NBA DRAFT,June 26,RYAN DUNN,"Everything that I thought of came to life. Flashbacks from when I was young. Just dreaming of being in this position, walking across that stage in my mind. Hearing my name be called and walk across the stage today, it all came true. It was just God gave me this to be here."
2024 - NBA DRAFT,June 26,RYAN DUNN,"It helped me a lot. That program at Lu High was probably the best decision I made, to go for my two years' program. I'm forever grateful to Coach John Buck and Coach Josh Corbin to give me an opportunity to play there."
2024 - NBA DRAFT,June 26,RYAN DUNN,Their practices are like college practices. So I was prepared to go into that. Just having the competitive mindset helped me a lot.
2024 - NBA DRAFT,June 26,RYAN DUNN,"I think it was Coach Bennett. I wasn't really known as a good defender coming out of high school. Once I got to UVA and had my growth spurt, I think I got some God-given talents. Coach Bennett drilled that mindset in me, and I was able to take off at Virginia."
2024 - NBA DRAFT,June 26,RYAN DUNN,"I'm excited. I'm excited. Great program. They want to win a championship and they have got great players to do it. I'm going to try to get down there, go to work and see what I've got to do to get there."
2024 - NBA DRAFT,June 26,RYAN DUNN,"Yeah, I think I can. It's just getting a lot of reps in practice and everything like that. Just getting the confidence and just let it go. That's what I'm going to try to do in Phoenix, is be in the gym a lot. Just do what I've got to do as a team."
2024 - NBA DRAFT,June 26,RYAN DUNN,I am. Born and raised.
2024 - NBA DRAFT,June 26,RYAN DUNN,"It's crazy because he lives in Arizona as well. We are both going to be in the same state again living together. It's going to be good. Being from New York representing not only as two athletes but as brothers in different sports, it's amazing and I'm grateful."
2024 - NBA DRAFT,June 26,RYAN DUNN,He's actually in Arizona. That's where he's staying. He's rehabbing on that.
2024 - NBA DRAFT,June 26,RYAN DUNN,"He's not with a team, but he's going to start throwing for a team soon."
2024 - NBA DRAFT,June 26,ROB DILLINGHAM,"I'd say it's just a blessing, for real, to even be here because you work your whole life and you never know if you're going to make it. So when you finally get there, it's just a blessing."
2024 - NBA DRAFT,June 26,ROB DILLINGHAM,"Yeah, playing with Anthony Edwards and the whole Timberwolves. They were in the Western Conference Finals. So it's really just a blessing because I get to learn from a lot of players and veterans and players that are real good. Them helping me is just a plus for me."
2024 - NBA DRAFT,June 26,ROB DILLINGHAM,"I didn't really get to work out with them, but I used to see Ant at Overtime Elite a lot, for sure."
2024 - NBA DRAFT,June 26,ROB DILLINGHAM,"It's a blessing, for real. It shows that they trust me and they obviously are trusting in me to develop. If they trust in me, that's all I needed. I feel that's all I needed from any team. Them showing me is even more of a blessing. I get to play with way better players and learn from them."
2024 - NBA DRAFT,June 26,ROB DILLINGHAM,"I'd say it's a blessing to even be here in this situation. I thank the Timberwolves, for sure."
2024 - NBA DRAFT,June 26,ROB DILLINGHAM,"I would say the open space on the floor. There's so much open floor, and I feel like I'm quick so I can get past dudes. It's really the fact of me getting past dudes and making decisions. You're playing with a bunch of NBA players, so players can't really help off super a lot because these are NBA players and they knock down shots."
2024 - NBA DRAFT,June 26,ROB DILLINGHAM,"I feel like, for me, getting past my defender and making plays for my teammates will be way easier, and then if they don't help, then it's just a bucket."
2024 - NBA DRAFT,June 26,ROB DILLINGHAM,"I feel like it would be easier. Once I know the assignment and what my coach wants me to do, it's not really me adjusting. It's just me doing what he says. I feel like anything Coach tells me to do, I can adjust to and I can make it happen. So I feel like it's a good feel, for real."
2024 - NBA DRAFT,June 26,ROB DILLINGHAM,It's crazy. It just shows you a lot of things work in ways you never think because we came in and we were roommates and we were really in the same position. We didn't know if we were going to get past our first year. We were just playing basketball.
2024 - NBA DRAFT,June 26,ROB DILLINGHAM,"Me seeing Reed, my roommate, he's a great dude. He always pushed me and he always helped me. Me seeing him and we going together, it's just crazy to even see, and I'm thankful."
2024 - NBA DRAFT,June 26,PACOME DADIET,"Honestly, the workout went pretty well. I knew they were interested, but until the last minute, I didn't know where I was going. I'm very excited to start working. I can't wait."
2024 - NBA DRAFT,June 26,PACOME DADIET,No. I'm planning on playing here.
2024 - NBA DRAFT,June 26,PACOME DADIET,"Obviously, I talked to the people over there. I got to learn more about the team."
2024 - NBA DRAFT,June 26,PACOME DADIET,"I was in the facility, everything. They showed me around. It was nice."
2024 - NBA DRAFT,June 26,PACOME DADIET,"I think it's beautiful. I took a lot of risk. I left France when I was 17. So I did the last two years in Germany. I felt like it was a risk, and I believed in myself. I worked a lot and stayed confident."
2024 - NBA DRAFT,June 26,PACOME DADIET,"First, I would definitely say my brother, six years older. He was already playing basketball. But my first favorite player was probably KD."
2024 - NBA DRAFT,June 26,PACOME DADIET,"I think I'm really versatile, but I can also bring what a rookie needs to bring in a team. Bring some energy. Being able to grab a rebound, push the ball but also knock down shots. I think it's very important for a rookie to bring these things."
2024 - NBA DRAFT,June 26,PACOME DADIET,"I don't know anybody personally on the team. But I talked with the coach, yeah."
2024 - NBA DRAFT,June 26,PACOME DADIET,"And yeah, it was nice to see him. I'm used to seeing him on TV. It was a little different, but I enjoyed it."
2024 - NBA DRAFT,June 26,TRISTAN DA SILVA,"I feel like I fit in great. I'm going to make sure that I get myself adjusted to whatever the team needs, whatever the players on that team need for us to be successful. With my high IQ and my versatility, I feel like there's a lot of different spots that I can fill and a lot of different needs I can address."
2024 - NBA DRAFT,June 26,TRISTAN DA SILVA,"Basketball IQ, for sure. Making the right reads. Making smart plays. Being in the right position. I feel like that's very underrated, being in the right position and reading your defender. That's a lot of my game where I get my advantages from."
2024 - NBA DRAFT,June 26,TRISTAN DA SILVA,"I'm going to continue it do that, and I feel like that's going to help everybody else on the floor as well."
2024 - NBA DRAFT,June 26,TRISTAN DA SILVA,"Right, to the efficiency point. I feel like that's huge for me, just because I like to play the right way. I feel like me playing the right way is me getting good shots, whether that's open shots or good layups at the rim. I feel like I'm just reading the game and adjusting to whatever the defense does. When I get a good look, it's more prone to go in than not."
2024 - NBA DRAFT,June 26,TRISTAN DA SILVA,"And then to your other point, hopefully we'll make it three. That would be really historic. Yeah, Colorado is not looked at as a draft pick-producing university like these other programs are. But if you look at the history, there's a lot of really, really solid players that have stuck around a long time in the league. It's just a testament to what Coach Boyle and his coaching staff have done at Colorado."
2024 - NBA DRAFT,June 26,TRISTAN DA SILVA,I'm excited to get to know them even more. We've got mutual friends. I've met them for the first time this past summer when my brother was playing on the national team and I went up there to Berlin to watch one of the games.
2024 - NBA DRAFT,June 26,TRISTAN DA SILVA,"But great people. They know my brother more than they know me, but they have already reached out to me through mutual friends. They make it very comforting to come to Orlando."
2024 - NBA DRAFT,June 26,TRISTAN DA SILVA,"I talked with him earlier today, or tonight. I'm super excited, just learning from one of the great coaches. I feel like there's a lot that I can expand my game in, and I can't wait to learn even more. I feel like talking basketball and talking basketball IQ is one of my passions, as well, in the game. I'm just super excited to soak up all that knowledge and kind of grow."
2024 - NBA DRAFT,June 26,ISAIAH COLLIER,"It's a blessing being here in the NBA Draft. One of many guys, and I'm just blessed to be in this space."
2024 - NBA DRAFT,June 26,ISAIAH COLLIER,"I'm looking forward to playing with everybody, to be honest. I've heard a lot of great things about Utah. I'm just looking forward to learning a lot about it and living there."
2024 - NBA DRAFT,June 26,ISAIAH COLLIER,I've never been to Utah. I don't think so.
2024 - NBA DRAFT,June 26,ISAIAH COLLIER,"They are about to get a dog. I'm just looking forward to going in there and competing from day one, showing what I can do and just prove myself in the league in general."
2024 - NBA DRAFT,June 26,DONOVAN CLINGAN,"Yeah, I mean, I'm really proud of Steph, happy for Steph. As a freshman, for him to come in and do what he did, help lead that team to another national title, is something very hard to do as a freshman. I love that kid to death. I'm extremely happy for him, and I'll be his biggest fan this year."
2024 - NBA DRAFT,June 26,DONOVAN CLINGAN,"Yeah, it's been a crazy two years, from winning one national title to winning the Big East regular season to the Big East Tournament and then winning another national title. A lot of winning, a lot of succeeding the past two years. I feel like I'm going to keep that chip on my shoulder and go into Portland with just a lot of confidence, with a willingness to learn and get better every single day."
2024 - NBA DRAFT,June 26,DONOVAN CLINGAN,I just want to have an impact and try to help this organization win and get to the top and try to win championships.
2024 - NBA DRAFT,June 26,DONOVAN CLINGAN,"I'm really excited. I feel the connection with some of these young guys I've watched since I was in high school. Scoot Henderson, in particular. I feel like we have a chance to do something really special."
2024 - NBA DRAFT,June 26,DONOVAN CLINGAN,"I'm young. Having a young team, just growing up around the same age, everyone learning and getting better every day, I'm really excited. I feel like I'm at a loss for words right now. I don't even know what else to say. I'm just excited and extremely blessed for this opportunity, and I'm really ready to get to Portland and get to work."
2024 - NBA DRAFT,June 26,DONOVAN CLINGAN,"Being able to space the floor, knock down the three ball, playmake at a high level. I feel like I can handle the ball at the top of the key, pass the ball at a high level and I can shoot the ball at a high level."
2024 - NBA DRAFT,June 26,DONOVAN CLINGAN,One thing about me is I want to be a great teammate. I want to be the best teammate. I want to be the best player that Coach wants to coach every day. Coach is happy about coaching him because he gives his all. I want to be that guy. I'm just ready to get to work.
2024 - NBA DRAFT,June 26,DONOVAN CLINGAN,It's a great feeling. You dream of this moment your whole life. You watch it on TV every single year. To have that moment here in front of you today and to hear my name called is something that I'll remember for the rest of my life.
2024 - NBA DRAFT,June 26,DONOVAN CLINGAN,"That was a really special moment. Like I said, I'm extremely blessed and grateful for everyone that has helped me to get to this point. I'm ready to get to work and ready to learn and ready to try to impact winning."
2024 - NBA DRAFT,June 26,DONOVAN CLINGAN,"Yes, I just did."
2024 - NBA DRAFT,June 26,DONOVAN CLINGAN,"It was great. I like Coach a lot. When I went out there for my visit, he was a good dude, great dude. The whole staff, the whole organization, you can really tell people that want to learn and want to win and learn and get better. That's something -- that's what I'm about, and I'm really ready to go get going."
2024 - NBA DRAFT,June 26,DONOVAN CLINGAN,Too young.
2024 - NBA DRAFT,June 26,DONOVAN CLINGAN,"Yeah, it just shows that we were the best program in college basketball and they still are right now. Coach Hurley is the best coach in college basketball, and he's producing players at a high level every single year."
2024 - NBA DRAFT,June 26,DONOVAN CLINGAN,"I'm not sure the exact number of draft picks he's had these past five years, but Coach Hurley has been the top of the top in college for a couple years now. I love that man to death."
2024 - NBA DRAFT,June 26,DONOVAN CLINGAN,No. Just spend some time with some family. Soak everything in. Realize my life is going to change forever.
2024 - NBA DRAFT,June 26,STEPHON CASTLE,"They always told me that they were super high on me. But of course it's the NBA Draft, so you can't make any promises to anybody."
2024 - NBA DRAFT,June 26,STEPHON CASTLE,"I just can't wait to get out there and show my versatility, especially with the kind of talent that we already have on that team. It being the youngest team in the league right now, I feel like our future is pretty bright. I just can't wait to get out there."
2024 - NBA DRAFT,June 26,STEPHON CASTLE,"Yeah, definitely. Just being able to show my playmaking ability with such a great teammate like that. And just learning how to play off the ball at UConn, so being able to show that as well, especially with having a great teammate like Victor. Being able to set ball screens for him and cut in space when teams are trying to load up on him. Just trying to use all aspects of my game to just impact winning."
2024 - NBA DRAFT,June 26,STEPHON CASTLE,"It's really hard to prepare for that moment. I mean, it's just a lot of emotions running through your head, especially when you hear your name being called."
2024 - NBA DRAFT,June 26,STEPHON CASTLE,"But on the basketball side of things, just always keep your head down, always working. Just staying humble and just having all that self-confidence in myself that everything is going to work out."
2024 - NBA DRAFT,June 26,STEPHON CASTLE,I was just playing for the best coach in college basketball and now flipping to the NBA and going to play for a legendary coach like Coach Pop. It's a blessing.
2024 - NBA DRAFT,June 26,STEPHON CASTLE,"On the culture side of things, it's not really a big culture change from UConn to San Antonio. Just being out there in the pre-draft process, you can tell it's a hardworking program and super hard-nosed. I just can't wait to go out there and just show what I got."
2024 - NBA DRAFT,June 26,STEPHON CASTLE,"Everything is just happening like really, really fast. Just being in the natty, soaking in that moment with my teammates, that's a super big accomplishment. And flip over to a couple months later and you another one of your teammates are top-10 picks. It really means the world to me and I wouldn't trade this for anything."
2024 - NBA DRAFT,June 26,STEPHON CASTLE,"I just talked to him on the phone not too long ago. We were just talking about coming down to San Antonio and just can't wait to get to work, and just excited for our future and excited for this upcoming season."
2024 - NBA DRAFT,June 26,STEPHON CASTLE,"It means a lot. Me and D.C. have been through so much together. I was friends with him before I got to UConn, before I committed to UConn. I've known him forever now. I mean, I know how much he's been through."
2024 - NBA DRAFT,June 26,STEPHON CASTLE,"For that to happen, it's such a great reflection on our program and just it's a reflection on all the hard work that we've put in. It's really a blessing."
2024 - NBA DRAFT,June 26,STEPHON CASTLE,"Nah, he didn't tell me that as soon as I got drafted. That's probably a conversations we'll have a little later."
2024 - NBA DRAFT,June 26,STEPHON CASTLE,It's all good.
2024 - NBA DRAFT,June 26,STEPHON CASTLE,That's a castle for my last name. This is a castle.
