event,date,person,quote
2024 - WNBA DRAFT,April 15,CHARISMA OSBORNE,"Yeah, I think going in the third round, that's just a number, and I think I'm just going to go out there and do my best and show what I can. I'm really confident in my skills and my abilities. Obviously, I've earned this moment to be here."
2024 - WNBA DRAFT,April 15,CHARISMA OSBORNE,"So I think, like I said, that's just a number, and I'll go out there and try my hardest and make the team."
2024 - WNBA DRAFT,April 15,CHARISMA OSBORNE,All the flavors tonight. All the flavors.
2024 - WNBA DRAFT,April 15,CHARISMA OSBORNE,"I think I was just nervous the entire night, so the feelings didn't really change. I was pretty much nervous. But I know when I heard my name, I was just so excited, and I can't wait to get to work in Phoenix."
2024 - WNBA DRAFT,April 15,NIKA MUHL,"I mean, if you saw my face, I don't think anything was going through my head at the moment. I was so positively overwhelmed, and just having all of them around me, all my people in the stands, at the table, knowing that my family, my friends from back home are watching, it's surreal. It's why I'm here. Without them, I would never be here sitting and answering your questions."
2024 - WNBA DRAFT,April 15,NIKA MUHL,"I owe everything to them, and I'm just truly blessed and so grateful for Seattle to give me this opportunity."
2024 - WNBA DRAFT,April 15,NIKA MUHL,"Thank you for your question. I love Sue. I love her so much. I remember watching her when I was a kid, trying to mimic her moves. Being at UConn after her has been a huge deal for me. Very, very humbling experience. She's one of the greatest."
2024 - WNBA DRAFT,April 15,NIKA MUHL,"To be able to have this opportunity again, I mean, it's a full-circle moment for me. I can't believe it. It's got to be some higher power, something else going on, because I have no words for this. It's a full-circle moment for me, and I'm just so blessed."
2024 - WNBA DRAFT,April 15,NIKA MUHL,"I honestly have no idea about the jersey number. That's honestly the least thing on my mind. That's not what I'm thinking about, but when I find out, I'll find you and tell you first."
2024 - WNBA DRAFT,April 15,NIKA MUHL,"Absolutely. I feel like going back to when I had to make my college decision, UConn was a challenge, especially coming in with my class, Paige Bueckers, No. 1 player in the country, that was a huge challenge, but I took it. I feel like it paid off, and that's one decision that I'm so happy and proud that I made in my life because all of that led to this."
2024 - WNBA DRAFT,April 15,NIKA MUHL,"But to get back to your question, I feel like first and foremost, I obviously -- their roster, just looking at it, those are some iconic women. Those are some iconic basketball players, people that I want to learn from, that I want to listen to, that I want to get challenged by, that I want to get yelled at, everything, all of the above. I'm ready for it, and I feel like it's kind of like a similar thing for me going to UConn and going to this place. Obviously, this is the next level."
2024 - WNBA DRAFT,April 15,NIKA MUHL,"But I feel the same. I feel eager to learn. I feel eager to be challenged and eager to fail and rise up, and I feel like that coaching staff and that team will do it for me."
2024 - WNBA DRAFT,April 15,NIKA MUHL,"The one thing that I want to bring is being a good teammate. I want to create amazing relationships over there. I feel like that's what makes and helps teams win, and I want to be a part of that winning program because it truly is a historic winning program."
2024 - WNBA DRAFT,April 15,NIKA MUHL,"Well, first and foremost, I feel like this was something that I didn't even dare to dream about, if I can say it that way. I always felt like it was such a reach. It was something far more beyond me and bigger than me. But luckily I had people around me, my teammates, my friends, my family, my coaches, everybody that made me believe in it, too."
2024 - WNBA DRAFT,April 15,NIKA MUHL,"I always trust my work ethic. I feel like that's my best asset, how hard I work, how I don't give up, how I learn from my mistakes."
2024 - WNBA DRAFT,April 15,NIKA MUHL,"Obviously I'm going to fail, and that's fine. But it's how you react to it. I'm ready for all the challenges. I'm ready for whatever is thrown my way. But I know I'm going to respond in a positive way and how a true competitor does."
2024 - WNBA DRAFT,April 15,NIKA MUHL,"Absolutely. Thank you for the question. I feel like as you grow, you learn and you mature. When I came in as a freshman, I didn't understand that you don't have to be in the gym all day. It's how hard you work for those 45 minutes, those 20 minutes, and how consistent you are with it. I feel how my coaching staff, especially Morgan Valley, my coach, she kind of helped me guide me through that. This last, my senior year, I spent 25 minutes before every single practice, even on the days that I didn't feel like it, even on the days that I was tired, and shot threes and shot mid-ranges."
2024 - WNBA DRAFT,April 15,NIKA MUHL,"That 40 percent that you mentioned is purely the testament to my hard work and dedication and her being in that gym with me every time. I'm so grateful to her. But I'm also very proud of myself and how I just remained consistent and proved to myself that consistency is the key, because hard work I already have it. Consistency was the key for me."
2024 - WNBA DRAFT,April 15,NIKA MUHL,"Yes, thank you. I feel like us UConn players, we're a family. It doesn't matter if we played 30, 20, 10 years ago or even before that, or you're playing right now or you are going to play in the future. Everybody is connected. That's what the coaching staff does a great job of, creating that family atmosphere, that strong bond and connection that lasts forever."
2024 - WNBA DRAFT,April 15,NIKA MUHL,"That's how it is with Sue. She's been over to UConn so many times, whether that's like fun stuff or coming to watch our games or trying to help us and guide us and give us advice, because we all truly look up to her a lot."
2024 - WNBA DRAFT,April 15,NIKA MUHL,"I mean, I'll say it again, it's a full-circle moment for me. All the things that kind of led up to this, it's crazy. I can't believe it. But I'm just super grateful and I can't wait to see her. I'm sure she's going to be of a great help, and my mentor and somebody that's going to guide me, and I want that."
2024 - WNBA DRAFT,April 15,NIKA MUHL,"But to get back to your other question. Absolutely, Nneka, Skylar, those women are incredible, on and off the court. I can't wait to learn from them, and of course I watched them. Skylar, I watched her so much. Nneka, I mean, she hugged me and I almost passed out over there. And obviously the rest of the team. When you look at the names, what they've done -- I always go back to not just on the court but off the court with the influence that they have. I can't wait to be a part of that. I can't wait to learn. I can't wait to just listen and sit back and try to get everything I can from such influential, iconic women. I'm super, super excited. I can't wait to meet all of them."
2024 - WNBA DRAFT,April 15,NIKA MUHL,"Yeah, I mean, that's a funny question because growing up, I didn't really have the opportunity to watch WNBA games. Even now in Croatia, people have to find their ways to watch those games. I feel like what I remember, I would sit in my living room with YouTube and find games or highlights or anything that I can. I remember watching Brittney Griner in my living room. It's just those little things that stick with me. But it was hard to find places and ways to watch these women."
2024 - WNBA DRAFT,April 15,NIKA MUHL,"I feel like seeing now especially with this draft class that I'm a part of, amazing athletes, amazing people that brought women's basketball to another level, and I always say, all the players before us that paved the way for us, they deserve their flowers, and they deserve to be recognized. I feel like we're moving toward that direction, and I never think it's too late. I always think there's time to be better and improve and grow, and I feel like we're on the right track."
2024 - WNBA DRAFT,April 15,NIKA MUHL,"Yeah, Aaliyah has been there from the start. That's my sister. That's my family. I met her even before we both committed to UConn. Can you guys believe how full circle -- it's so many full-circle moments I can't even fathom right now. We met before at NBA Academy, BWB, and I loved her instantly. Our bond is strong. We don't need no words. You can feel it. You can feel the energy. To be able to here with her and share this has been nothing but incredible, and something that I'll remember for the rest of my life because it would not be the same if she wasn't here with me."
2024 - WNBA DRAFT,April 15,NIKA MUHL,"I'm so proud of her. She's going to do amazing. She's going to do great. Everything that she did, she deserves. She put her head down and she worked. Even without all the recognition that she did deserve but she didn't get at times, she didn't care. She put her head down and she knew that something great will happen, and it did tonight. I'm so happy for her."
2024 - WNBA DRAFT,April 15,NIKA MUHL,"But to get back to the other question, Paige, Azzi, Aubrey, Caroline, all my teammates watching at home, I love them so much. I owe them everything, and I can't wait for my younger teammates and everybody that's coming back next year to have this moment, too, because I know they will. I'll be proudly watching and cheering for them, too."
2024 - WNBA DRAFT,April 15,NIKA MUHL,I'm just so grateful to be able to call them my sisters and my family and have such great support even though I'm not home. This is my home away from home. They are my home away from home.
2024 - WNBA DRAFT,April 15,NIKA MUHL,"Yes, absolutely. I feel like I couldn't get more prepared than being at UConn, surrounded by all the coaches, but especially Coach. He's just a legend. When UConn called, I couldn't say no. That was the opportunity of a lifetime for me."
2024 - WNBA DRAFT,April 15,NIKA MUHL,Every single thing in that culture that he built in that program aligns with me and who I am as a person and who I strive to be and get better at being.
2024 - WNBA DRAFT,April 15,NIKA MUHL,"But just the things I went through with him is so much, and he's my best friend. He's not just my coach, he's my best friend. He's been there from the start. When I failed, through the worst things, through the best things, he always stuck by my side and never left. I'll cherish that bond and that relationship that I have with him forever."
2024 - WNBA DRAFT,April 15,NIKA MUHL,"I'm so grateful and happy that he was there tonight, along with all my coaches, at the table and in the audience. They prepared me. They pushed me. They cussed me out when they had to. They yelled at me when they had to. They praised me when they had to. They just did everything right."
2024 - WNBA DRAFT,April 15,NIKA MUHL,"So grateful because not just as a basketball player they have changed me, but they changed who I am as a person. They made me a better person and they make me want to be even better. I'm grateful for them."
2024 - WNBA DRAFT,April 15,ELIZABETH KITLEY,"Yeah, I think my emotions have been so up and down over the last six weeks. I had different expectations in February than I did at the end of March. I think I've been dealt with what I've been dealt with, and the only way to really move on is to have a positive outlook."
2024 - WNBA DRAFT,April 15,ELIZABETH KITLEY,"Honestly, I'm so excited for the fit. I'm really excited for Vegas. I think that's really promising. To be able to learn from the people at Vegas for the next year, what more could you ask for? If I'm not able to play on the court, I know that I'll be able to benefit mentally and emotionally just by observing what they have there."
2024 - WNBA DRAFT,April 15,ELIZABETH KITLEY,"I'm really excited, and that's my No. 1 emotion right now."
2024 - WNBA DRAFT,April 15,ELIZABETH KITLEY,"Well, they're always there for me, first of all, no matter if I go out and have 25 in a game or if I can't play. I know they're going to be at the game. They're going to be the first ones hugging me afterward. That support has meant the world to me over the last 15 years that I've been playing basketball or sports at all."
2024 - WNBA DRAFT,April 15,ELIZABETH KITLEY,"For them to be able to be here with me on draft night, my family, my sister, my parents, it means everything to me. It's not just a testament to what I've been able to do but how they've been able to help me get here."
2024 - WNBA DRAFT,April 15,ELIZABETH KITLEY,"Yeah, I didn't start playing basketball super seriously until probably middle of high school, so I wasn't exposed to it super early. But I also think the media didn't push it as much. Even though I played basketball in high school, it wasn't necessarily something that was super popular in the media."
2024 - WNBA DRAFT,April 15,ELIZABETH KITLEY,"But I'm super excited for it to be taking that trajectory. The class that I'm in right now has done an incredible job to bringing attention to women's sports, women's basketball, and now taking it into this league I think is super exciting."
2024 - WNBA DRAFT,April 15,ELIZABETH KITLEY,"I think we're already seeing the impact of that on little girls. I think they're way more aware of it than I was at that age, and that's super exciting. I think with expansion coming up and all that stuff, it's headed toward a really good place. I'm really excited to be a part of it."
2024 - WNBA DRAFT,April 15,ELIZABETH KITLEY,"Yeah, honestly I'm thrilled. I can't think of a better situation to be in with the situation that my leg is in, because it's just an incredible fit. I think their resources are amazing, their facilities are awesome. To be able to look up to the players there, to be able to watch A'ja Wilson, even though I can't play, I know I'll be able to learn so much and get better just by watching and being around the culture that's there."
2024 - WNBA DRAFT,April 15,ELIZABETH KITLEY,"That means everything. Those five years at Virginia Tech were so, so special. I wouldn't change a thing about it. The people I had around there, the teammates, the coaches, they were just incredible. They made me who I was. For me to bring that attention to Virginia Tech, to take it to a Final Four, win ACC championships, was just so fun. For them to recognize me I think is really, really cool, but it's also just making me really proud of the program that we were able to create there."
2024 - WNBA DRAFT,April 15,ELIZABETH KITLEY,"Yeah, I was just able to talk to Coach Becky Hammon a little bit. Obviously there's a little bit more to be figured out, but she spoke about the medical staff there and just working on getting me out there, so we can see where I am and start taking those steps to get me back on the court again because obviously that's the ultimate goal."
2024 - WNBA DRAFT,April 15,ELIZABETH KITLEY,"But I'm super excited. I think seriously it's a great fit for all of those things. I know that they'll support me, and we'll all have the same goal of getting me healthy and helping to contribute. We'll take it day by day but with that in mind for next year."
2024 - WNBA DRAFT,April 15,ELIZABETH KITLEY,"Yeah. I mean, he's taught me everything I know. I didn't come into college expected to be anything really. I really didn't take basketball super, super seriously. I thought I wanted to play softball when I was little in college. He completely changed my perspective on that. He made me fall in love with the game to the point where you couldn't get the two of us out of the gym together. We just love spending time with each other in there."
2024 - WNBA DRAFT,April 15,ELIZABETH KITLEY,"I definitely wouldn't be here without him. He completely transformed my game into something that I think is pretty unique and special, and I'm so appreciative for him because of those things. I love him like he's family."
2024 - WNBA DRAFT,April 15,RICKEA JACKSON,"Yeah, I feel like I'm looking into them pouring into me, and I'm doing the same on and off the court."
2024 - WNBA DRAFT,April 15,RICKEA JACKSON,"I'm so excited to play with Cam. We're both competitive. We're young. We're feisty but we're still going to bring that game offensively and defensively. I know if I get beat off the dribble, Cam is swatting into the second row. So I'm ready for that, too."
2024 - WNBA DRAFT,April 15,RICKEA JACKSON,"Yeah, I feel like I'm excited to bring my versatility, play at any position, taking advantage of whether it's a small guard on me or bigger or slower player. I'm excited about that. Then I just want to work on getting in tip-top shape after the injury. My conditioning was in the game trying to get back. I feel like when I'm in tip-top shape, world-class shape, that's when I'm playing my best both ends of the floor."
2024 - WNBA DRAFT,April 15,RICKEA JACKSON,"Yeah, I'm definitely excited. I'm just grateful that L.A. believed in me. They see something in me, and I see something in them, too. I had great talks with them prior to the draft, so I'm just grateful for it all."
2024 - WNBA DRAFT,April 15,RICKEA JACKSON,"Playing at Tennessee and Mississippi State, it's prepared me for this moment because life is just trials and tribulations, but how you get through those, and I feel like I've overcome a lot of adversity. I've continued to stay strong, and that's what got me to where I am today."
2024 - WNBA DRAFT,April 15,RICKEA JACKSON,"Yeah, it's crazy to say, but I didn't even think about how the draft process goes. I thought you just show up to draft day and you kind of get drafted. I didn't know if they even speak to you prior to the draft. Really crazy of me."
2024 - WNBA DRAFT,April 15,RICKEA JACKSON,"Yeah, I'll answer your second question first. Definitely. This is generational class. I feel like this class is just so different. I know this class is different. I feel like the viewership is peaking. Women's basketball is on an uproar. Everybody is tuning in. We averaged better than the men this year. Not to say we're in competition, but that just says a lot. I'm grateful to be a part of this draft class. I feel like we're just trending in the right direction."
2024 - WNBA DRAFT,April 15,RICKEA JACKSON,"Probably the pace of the game. I feel like high school to college, it was a different pace, so I feel like it's probably going to be that same thing in the league, going up against the world's best players. I feel like that's going to be pretty tough. But I'm excited for the challenge."
2024 - WNBA DRAFT,April 15,RICKEA JACKSON,"Yeah, to be in the conversation with those greats is so crazy and mind blowing to me. I'm just grateful to have Candace come to our games sometimes, have Tamika Catchings, have Jordan Horston in my ear, and they continue to support me. Jordan texted me how much she was proud of me, texted me a little bit about the process. Tamika and I speak every now and then. She's just always pouring into me. I just call her my big sister. Just to have that contact with a Tamika Catchings, it's like, whoa."
2024 - WNBA DRAFT,April 15,RICKEA JACKSON,"She doesn't even know it, but when she came to our practice and she was acting like she knew me, you don't even know but I was over here like, girl, you're Tamika Catchings. That was pretty cool to experience, though."
2024 - WNBA DRAFT,April 15,RICKEA JACKSON,"I would give her advice of just be true to who you are. Problems are going to come, challenges are going to come, but the way that you handle it is what builds character. I feel like there's always a light at the end of the tunnel and just continue to just push, push, push. If she plays basketball, I would say repetition is everything. Get the fundamentals down, just work on the little things before -- this generation is a little more flashy, but the fundamentals are everything."
2024 - WNBA DRAFT,April 15,RICKEA JACKSON,"Yeah, growing up I didn't like basketball at all. I just wanted to do girly stuff. I just wanted to be a ballerina and cheerleader. I didn't watch basketball growing up. But once I picked up a ball and I started to see how serious this could go, I really started tuning in a lot. I watched every WNBA basketball game. Even if I can't, I record it and then I'd go back and watch it. I don't look at the score because I like to feel like it's still live. I like that excitement."
2024 - WNBA DRAFT,April 15,RICKEA JACKSON,"Just L.A. as a whole, I know they weren't where they wanted to be. Championships, everyone wants a championship. I feel like I'm just excited to be a part of this journey. I feel like we're going to be really good, just looking at the roster itself. I'm just excited. I've watched them play, so I'm kind of familiar of how they like to play, their style of play."
2024 - WNBA DRAFT,April 15,RICKEA JACKSON,"So that's pretty cool, and I feel like I'm going to fit in really well."
2024 - WNBA DRAFT,April 15,RICKEA JACKSON,"Yes, I'm so excited to play with Zia. It's so full circle. We grew up knowing each other. We played AAU together. We live like an hour away from each other, but that's my best friend, so we're still really close."
2024 - WNBA DRAFT,April 15,RICKEA JACKSON,But I feel like basketball is just always bringing us back together in the craziest ways. We took our four visits together coming out of high school. I'm so excited to play with my girl. I feel like this is just going to reconnect us on that deep level again.
2024 - WNBA DRAFT,April 15,RICKEA JACKSON,"Yeah, I'm honored, honestly, that she said something like that about Cam and I. I truly believe that, as well. I feel like what Cam and I bring is just foundational, like you said. I feel like we're willing to put in the work. We're willing to do whatever as rookies. So I feel like that's pretty, pretty good, and I'm just excited to get started."
2024 - WNBA DRAFT,April 15,DYAISHA FAIR,"It played a big role, knowing that we have a few athletes that have already came out of there, and to be one of them means a lot."
2024 - WNBA DRAFT,April 15,DYAISHA FAIR,"That's a really good question. I think I want to say that no matter what anyone says or anyone may think, and specifically regarding my height, I'm here, and watch me work."
2024 - WNBA DRAFT,April 15,DYAISHA FAIR,"To know that I'm going to such a special team with quite a few veterans means a lot. It's something like a perfect situation, I'm coming in to learn, and there's a lot to learn from, and like I said, there are a few vets on this squad. So to be able to walk into this situation is kind of perfect for me."
2024 - WNBA DRAFT,April 15,DYAISHA FAIR,"The first thing I would say to them is don't allow anyone to dim your light, no matter your size. I've dealt with that all the way up until today, tonight. Other than that, I would say that no matter what happens, if you want to achieve something, you can do that."
2024 - WNBA DRAFT,April 15,DYAISHA FAIR,"I want to learn from the vets as much as possible. I want to add a little bit of everything to my game. I want it to expand. I also want my IQ for the game to expand, as well."
2024 - WNBA DRAFT,April 15,DYAISHA FAIR,"Yes, I can score the ball, but what else are you able to do? I think that with those guards over there, they're going to do a wonderful job of helping me."
2024 - WNBA DRAFT,April 15,DYAISHA FAIR,"I'm very excited. I think that it's a full-circle moment for me. I was nominated for that Becky Hammon point guard award, I believe, three seasons in a row when I was at Buffalo. For me to have not received it and to be drafted by her when the time was right has been a full-circle moment, so I'm ready, and I'm ready to go."
2024 - WNBA DRAFT,April 15,CATHY ENGELBERT,"Good evening, everyone. It's great to see you all here. Welcome to the 2024 WNBA Draft presented by State Farm. This honestly is one of, I think, my favorite days of the year. We're thrilled to be at the famed Brooklyn Academy of Music for the first time."
2024 - WNBA DRAFT,April 15,CATHY ENGELBERT,"BAM is actually America's oldest performing arts center, hosting some of the brightest talents across a wide range of concentrations since 1861. Tonight, BAM hosts some of the brightest talents in basketball."
2024 - WNBA DRAFT,April 15,CATHY ENGELBERT,"You all may have noticed the fans coming in tonight, and I know some of you got held up. We apologize. But this is the first time the draft has had fans in attendance since 2016. Tickets sold out in under 30 minutes, and that was before the players declared for this draft. Just another illustration of the passion and excitement surrounding the WNBA right now."
2024 - WNBA DRAFT,April 15,CATHY ENGELBERT,"The next chapter in each player's basketball journey starts tonight. I have the ultimate honor of calling their names and seeing the excitement from them, their families, their friends and team representatives as they take the first step of their professional careers."
2024 - WNBA DRAFT,April 15,CATHY ENGELBERT,"This is just one ""Welcome to the W"" moment for this class. I spent time with them last night and earlier today at the Empire State Building, which will once again brighten up the skyline with WNBA orange tonight. This is a great group of young women. I also spent some time with their parents last night and today and with their families. I'm so excited to see what they will all bring to this league."
