event,date,person,quote
2024 - NBA DRAFT,June 26,STEPHON CASTLE,And that's my initials right on the bottom.
2024 - NBA DRAFT,June 26,STEPHON CASTLE,The last thing I'll do in probably just celebrate with my family. I was born here in New York. So I have a lot of family here at the draft. Just doing whatever I can to show how much appreciation I have toward them for all their support right before I go out to San Antonio and start my next journey.
2024 - NBA DRAFT,June 26,STEPHON CASTLE,"Well, I mean, what I picked for the draft, it wasn't intentional. But I guess it all really worked out. I guess I kind of manifested it to happen for me."
2024 - NBA DRAFT,June 26,STEPHON CASTLE,But I wasn't really expecting anybody in particular to pick me. I didn't have any expectations. I was really open-minded to everything. I'm happy that it went the way that it did. I'm super blessed for the Spurs organization taking a chance on me and I just can't wait to get out there.
2024 - NBA DRAFT,June 26,DEVIN CARTER,"Oh, man, just want to thank God first, first and foremost, just for putting me in this position. I was ready to get ready to work. Coming in day one, do all the dirty work we need to do to win. I think I'm a winning player. I'm a win-now type of player, being one of the older guys in the draft. Just having that experience from college, and like I said, just doing all the dirty work, rebounding, diving on the floor for loose balls and just anything we need to do to win."
2024 - NBA DRAFT,June 26,DEVIN CARTER,"I would love to play alongside Malik Monk, De'Aaron Fox, I think we have a great big in Sabonis, probably one of best passers in the NBA from a big standpoint."
2024 - NBA DRAFT,June 26,DEVIN CARTER,"I'm just ready to be a two-way, versatile player. Get stops on one end, and I can also create some offense not only for myself but my teammates on the other end."
2024 - NBA DRAFT,June 26,DEVIN CARTER,"Yeah, I did work out for the Kings. Honestly, one of my better workouts, I believe. I think we had a very fantastic meeting with everybody who made the decision to draft me. Just very thankful for that."
2024 - NBA DRAFT,June 26,DEVIN CARTER,"Me and Coach Brown talked, how we see myself fitting in on the team, and just coachplayer talk. I think I got a good feel for Coach and he got a good feel for me. Just ready to start in journey."
2024 - NBA DRAFT,June 26,DEVIN CARTER,"It means everything. Just seeing his face whenever I got drafted, how happy he was, he didn't get a chance to get drafted. So just seeing his face and how excited he was for everything that we've been through, working out, countless hours throughout the night, morning. It's just a very special moment. Came up with handshake today and almost messed it up, but it's all right. We got it done."
2024 - NBA DRAFT,June 26,DEVIN CARTER,"Yeah, just me being confident, like I said, I know the type of player I am. I know what I bring to the court. I know I just wanted to give Kim the same promise he gave me when he first came to Providence, that he'll make me one of the better players in the conference. Just want to give him the same promise I got a seat for you at the green room table."
2024 - NBA DRAFT,June 26,DEVIN CARTER,"Just a mature, win-now, do-it-all type of player. Like I said, rebounding, dive on the floor, take charges, anything that is needed to do to win. Just very excited to play with some great players, and hopefully we can win a championship."
2024 - NBA DRAFT,June 26,BUB CARRINGTON,"I'm feeling about as good as you think I'd be feeling. It's a special feeling to finally be here and have my name called, and especially being so close to home. You know, that means a lot."
2024 - NBA DRAFT,June 26,BUB CARRINGTON,"It means a lot. Definitely because I would say when I was younger, I wasn't really like that in my area, and to now be sort of that guy that people want to see, especially being from the area and now back in the area. It means a lot to finally see all the stuff that I've done come to light."
2024 - NBA DRAFT,June 26,BUB CARRINGTON,I haven't even touched my phone yet.
2024 - NBA DRAFT,June 26,BUB CARRINGTON,"Definitely. Yeah, I'm pretty sure he has texted me already."
2024 - NBA DRAFT,June 26,BUB CARRINGTON,"Probably say he'll be at the first game, and ""Don't suck."" Something he would probably say to me."
2024 - NBA DRAFT,June 26,BUB CARRINGTON,"For sure, yeah, he ain't got no choice."
2024 - NBA DRAFT,June 26,BUB CARRINGTON,"I would say the biggest adjustment would be how they game plan. It's real strategic for the league. I'm starting to see that working out for all these different teams. They have a real game plan and strategy going into every single game, and if you don't execute it, you can't play. I feel like that's something I'm going to have to get adjusted to."
2024 - NBA DRAFT,June 26,MATAS BUZELIS,Feeling good. Super blessed. I'm ready to work. I'm going to give the Bulls organization everything I've got.
2024 - NBA DRAFT,June 26,MATAS BUZELIS,"Super excited, man. I mean, this is a dream come true. I've been thinking about this since a young age. It means the world to me."
2024 - NBA DRAFT,June 26,MATAS BUZELIS,"I'll dress well, but I'm worried about basketball. I'm not really worried about that. I want to win."
2024 - NBA DRAFT,June 26,MATAS BUZELIS,"Chicago is a winning program and I want to win. So being there, I can embrace it. I fit many different ways on the team. I feel like I can do everything on the court. Whatever Coach asks me to do, I'm going to do to the best of my abilities and I'm going to work hard."
2024 - NBA DRAFT,June 26,MATAS BUZELIS,See my family. That's it.
2024 - NBA DRAFT,June 26,MATAS BUZELIS,"The program did an amazing job, even when they had the shutdown. Look at all the picks that they had. Everyone is good. All the coaches are amazing. They did a great job with everyone that they produced. I can't thank them enough, honestly. I would do it ten times over again."
2024 - NBA DRAFT,June 26,MATAS BUZELIS,"How do I feel it improved my game? Being around NBA coaches, veterans, just being in the NBA atmosphere, playing NBA rules and all that."
2024 - ALL-STAR GAME,February 18,KARL-ANTHONY TOWNS,"It was amazing, amazing to be able to be in this position. After everything that happened last year with me and the injury and everything, you learn more to appreciate and cherish the moments and opportunity you're given. Tonight was one of those times where you just realize being in a locker room full of some greats in the NBA and the best players in the world and be able to be out here and be able to represent my country and my organization, I just wanted to cherish this moment and make the most of it."
2024 - ALL-STAR GAME,February 18,KARL-ANTHONY TOWNS,I didn't know it was going to be 50. I thought maybe it was going to be more like 15. But God is good. It's Sunday. I'm blessed to be in this situation.
2024 - ALL-STAR GAME,February 18,KARL-ANTHONY TOWNS,"It's great. Like I said, it's a huge honor. It's all because of my teammates. My teammates tonight kept finding me and passing me the ball."
2024 - ALL-STAR GAME,February 18,KARL-ANTHONY TOWNS,"I just was trying, like I said, to take advantage of the opportunity and make some shots. I wish I could have made a little more, but beggars can't be choosers on a night like this."
2024 - ALL-STAR GAME,February 18,KARL-ANTHONY TOWNS,"Indy is great. Indy is such a pinnacle of basketball. I had such love for Indy watching them. For me growing up, Reggie Miller was the guy that just was electric to me, especially his shooting. So to be able to be in the house that Reggie Miller, Larry Bird, Jermaine O'Neal, Ron Artest -- you know, we could keep going down the list. Even people like Monta Ellis, I want to give a shoutout to."
2024 - ALL-STAR GAME,February 18,KARL-ANTHONY TOWNS,"To be in the building where they had historical moments, it's really special."
2024 - ALL-STAR GAME,February 18,KARL-ANTHONY TOWNS,"Absolutely. Like I told him on the court, GOAT. He's one of those guys that probably will never come again. The talent, his ability to overcome all adversity and his ability to exceed people's expectations. Just tremendous respect for LeBron, tremendous respect for what he's done and the impact he's had on the game of basketball."
2024 - ALL-STAR GAME,February 18,KARL-ANTHONY TOWNS,"I'm just -- it's crazy. I'm just blessed to be with -- I have no kids, but I tell my niece and my nephew that they get to see their uncle playing with LeBron James, it's a really cool experience for those children to have those childhood memories."
2024 - ALL-STAR GAME,February 18,KARL-ANTHONY TOWNS,"I knew I had a lot, but I knew Ant was the one as always -- it's always Ant -- was looking at me saying -- he was breaking down the points to me on the bench. I knew it was something special because even Steph got up and was like, Get 50! Get 50!"
2024 - ALL-STAR GAME,February 18,KARL-ANTHONY TOWNS,"I hadn't been shooting the three ball well all night, but when I needed them to go in, they definitely did. God was good. I just was honored to be in the moment. I definitely tried to go the reverse through the legs. I couldn't make it in the All-Star Game, but I made it in a real game. Kind of funny how I did that."
2024 - ALL-STAR GAME,February 18,KARL-ANTHONY TOWNS,"Just my teammates getting me the ball. Especially when you're a big, you never know what's going to happen. For my teammates to trust me and want to give me the ball was just an honor and a blessing."
2024 - ALL-STAR GAME,February 18,KARL-ANTHONY TOWNS,"I've really got to say, I think it was great coaching. The play calls and stuff like that, they're fantastic. I would love possibly one day to be able to play for this coaching staff if everything lines up."
2024 - ALL-STAR GAME,February 18,KARL-ANTHONY TOWNS,I got hopes and dreams.
2024 - ALL-STAR GAME,February 18,JAYSON TATUM,"He was in the locker room before the game. Him, Adam Silver, and Dr. J, they were talking to us. Once they got done, I thought I was going to be able to shake his hand. I turned around, and he was gone."
2024 - ALL-STAR GAME,February 18,JAYSON TATUM,"I remember I was standing there like I never met Larry Bird. I've never been in the same room with him. As crazy as it sounds, it's never worked out."
2024 - ALL-STAR GAME,February 18,JAYSON TATUM,"So Taylor, our PR girl, saw him before -- I was sitting on the sidelines, and she grabbed me. She was like, He's over there. I got a chance to go meet him and tell him how much of an honor it was to meet him. He told me he was looking forward to meeting me. So that was crazy to hear him say that."
2024 - ALL-STAR GAME,February 18,JAYSON TATUM,"He's a lot taller than I thought he was. But obviously what he means to the game, what he means to the city of Boston and the Celtics, he's the ultimate Celtic. It was an honor to meet him."
2024 - ALL-STAR GAME,February 18,JAYSON TATUM,"All-Star Weekend is special, and it's always more special when you get to share it with a teammate or two. I've been fortunate enough to share it with him three times now. It was great. It was great to have a teammate, familiar face around, especially we get to share the same locker room."
2024 - ALL-STAR GAME,February 18,JAYSON TATUM,"It's a special weekend for us, for our families, obviously for our team, the Celtics. So it's always great."
2024 - ALL-STAR GAME,February 18,JAYSON TATUM,"Much deserved. Like you said, we scored 200 points. We had three guys score over 36 points, so it could have went either way. But Dame put on a show. I was happy for him. It was cool that I could take a backseat this year and kind of chill and get to enjoy the show a little bit."
2024 - ALL-STAR GAME,February 18,JAYSON TATUM,"Actually, I got to talk to him before the game started. The time difference is a little crazy. He actually is up -- he's a Finalist for Coach of the Year. He started off as an assistant coach, and the head coach got let go, and halfway through the season."
2024 - ALL-STAR GAME,February 18,JAYSON TATUM,"They were like in the 10th or 11th seed, and how he kind of turned around. They're in the 4th seed going into the playoffs. Extremely obviously happy for him. Happy for what he's been able to do over there and kind of turn that organization around."
2024 - ALL-STAR GAME,February 18,JAYSON TATUM,He loves it. He loves it over there. He loves being in Australia. He says the games are extremely competitive. The atmosphere is crazy. Hopefully they can continue and go all the way. But it's been great to see him turn that thing around and have a lot of success over there.
2024 - ALL-STAR GAME,February 18,JAYSON TATUM,"Meeting Larry, it was super quick. I had told him it was an honor to meet him, and he told me he was looking forward to finally get to meet me. Then we took a picture. So we didn't get to talk in detail."
2024 - ALL-STAR GAME,February 18,JAYSON TATUM,"It's much better being on the same team with JB. It's what I'm used to. We've competed against each other in practice for seven years now, so I'm kind of tired of doing that. So it's good to be on the same team for sure."
2024 - ALL-STAR GAME,February 18,JAYSON TATUM,"It's extremely important. Being an All-Star is obviously a reflection of the work that you've put in your whole life, the work that you've obviously put in the first half of the season, but it should be celebrated with your family. Nobody is successful by themselves. Everybody has a support group, people to help raise them, support them through ups and downs."
2024 - ALL-STAR GAME,February 18,JAYSON TATUM,"So this time this weekend is for obviously yourself, but to bring your friends, families, partners, or whatever it may be to this event, to this weekend because there's a lot of activities and things like that, and there's just memories. Memories that build with the people who essentially help you get to this moment."
2024 - ALL-STAR GAME,February 18,JAYSON TATUM,"I loved it. The shorter introductions, not being on the stage and all that, I'm definitely a fan of that."
2024 - ALL-STAR GAME,February 18,JAYSON TATUM,"East versus West, I thought it was cool. This is my first All-Star Game experience in East versus West. So that's kind of what I grew up watching. I enjoyed that."
2024 - ALL-STAR GAME,February 18,JAYSON TATUM,"Yeah, I liked it better this year honestly. It was a regular game. Halftime was a little shorter, and the introductions was a lot shorter. So it felt like a little bit more normal of a game than past years."
2024 - ALL-STAR GAME,February 18,JAYSON TATUM,"I think it's my responsibility. I understand the platform that I have and the position that I'm in. I'm in a position to inspire a lot of kids and a lot of people, and I think, as we all were inspired by somebody. I feel like, as you grow up, you should always keep that in mind, that somebody inspired you to get where you are today."
2024 - ALL-STAR GAME,February 18,JAYSON TATUM,"The larger your platform, I feel like the larger your responsibility is. Growing up from St. Louis, I always had it in my mind that I wanted to impact my community. I wanted to change and make St. Louis a better place than when I grew up. I didn't always know how to articulate that when I was younger, but from a very young age, I knew that I was going to be where I'm at today, and that I was going to inspire kids and help change lives back where I'm from."
2024 - ALL-STAR GAME,February 18,DONOVAN MITCHELL,I actually did it because Bron be doing it. Bron was in front of me. I thought let's just try it.
2024 - ALL-STAR GAME,February 18,DONOVAN MITCHELL,"No. Honestly, I don't really shoot one-legged threes. It was really a spur of the moment. I just saw LeBron is in front of me, and I figured why not go ahead and shoot a one-legged shot."
2024 - ALL-STAR GAME,February 18,DONOVAN MITCHELL,"Fortunately, I've been around a few times, so it wasn't my first time. But it's always a blessing, especially for the older guys. You've got Steph, LeBron, KD. Those three in particular, those are Hall of Famers, top-tier guys. It's always a blessing to share the court. As long as you can, you treasure those moments. Hopefully I'm talked about in the same category as my career continues to move forward."
2024 - ALL-STAR GAME,February 18,DONOVAN MITCHELL,It never gets old. You just find ways to enjoy each moment and embrace it.
2024 - ALL-STAR GAME,February 18,DONOVAN MITCHELL,"I told him he should have went for it before we started the game. He is back from injury, so he tried to pace it, I guess. I told him go ahead and go get it. He started off hot. Dame got going. There was a lot of scoring tonight."
2024 - ALL-STAR GAME,February 18,DONOVAN MITCHELL,"Not at halftime, there was no talk of it. That's the thing with athletes, though. You kind of have this within the game, and you could see it out there. Karl was going for it, J.B., Dame. You can see it. I think that's what makes it special, because now you've got guys taking shots and putting themselves in certain categories."
2024 - ALL-STAR GAME,February 18,DAMIAN LILLARD,Appreciate it.
2024 - ALL-STAR GAME,February 18,DAMIAN LILLARD,"You've just got to keep shooting the ball. I think, in a game like this, you know it's going to be pretty loose, and you're going to get your opportunities. Being in the starting lineup, I knew I'd play longer stretches, get more minutes."
2024 - ALL-STAR GAME,February 18,DAMIAN LILLARD,"I just told myself I'm going to be aggressive, and I'm going to keep firing. I saw a couple go in. After that, it was just like I'm going after it. So that was it."
2024 - ALL-STAR GAME,February 18,DAMIAN LILLARD,"The first one, I was super, super loose. Then the last one, I was actually kind of stiff. So I just had to shoot it a little bit higher. I got two of them in."
2024 - ALL-STAR GAME,February 18,DAMIAN LILLARD,"I think overall it's just our lockers are next to each other's. When you go somewhere outside of your team with a teammate, you usually naturally turn to each other more, just a lot of conversation. We're sharing our own experience away from this when we get around other groups."
2024 - ALL-STAR GAME,February 18,DAMIAN LILLARD,"Our coach was the coach. So a lot of our staff was around the whole time. I think it was just a positive weekend for us because we just had a lot of interactions. We were able to have conversations about where our team has been lately and what we want to do, how we can help each other better."
2024 - ALL-STAR GAME,February 18,DAMIAN LILLARD,"I think, when you can break away from not only the season and have All-Star break, but also break away from the team and us be able to just be man to man and kind of just bond like that, it's always helpful."
2024 - ALL-STAR GAME,February 18,DAMIAN LILLARD,"Like you said, me being able to come here and see how he's viewed around the league and him also to be able to come here and see how I'm viewed around the league. I think that just helps with any type of dynamic when you're trying to accomplish what we're trying to accomplish."
2024 - ALL-STAR GAME,February 18,DAMIAN LILLARD,"I think people who are fans of the game, they love it. They enjoy being entertained. I think it could be more competitive. I think in our game right now it's such a fast-paced game. We play a lot of games. The game has probably also had more injuries than it's ever had."
2024 - ALL-STAR GAME,February 18,DAMIAN LILLARD,"Usually our preparation to get ready to compete, it looks a lot different than it looks when we come here. This weekend was a lot better than the past, but I think when the game is any type of loose, if it's not a game where you've got a scouting report and you're locked in and a lot is on the line, then guys who are too talented, are going to make a lot of threes. That's the kind of game it's going to be."
2024 - ALL-STAR GAME,February 18,DAMIAN LILLARD,"Any time you're mentioned in the same category as Mike, it's an honor, and it's a major accomplishment, even if it's All-Star Weekend. If it was that simple, more people would have done it since 1988. So that's a major compliment for me to be mentioned in the same conversation as far as that."
2024 - ALL-STAR GAME,February 18,DAMIAN LILLARD,"Like you said, it's been a tough year, just the transition, being on a new team. We've had three coaches since I've been there. We've had coaches leave. Moving across the country. I've been on the West Coast my whole life with my whole family right there, just a tight group always in place."
2024 - ALL-STAR GAME,February 18,DAMIAN LILLARD,"I think any time you have these types of experiences where you have an adversity and things not just flowing like you expect it to or like you would want it to, I think that's the time you've got to just show who you really are. You've got to keep doing what you do, keep believing. When you do that, usually it comes back to you. There's some type of reward that comes forward."
2024 - ALL-STAR GAME,February 18,DAMIAN LILLARD,"You can't just fold. And that's what my mentality is. I did come into the weekend, when I knew I was going to do the 3-Point, I was like I'm going to try to win. I'm not going to be casual and cool about it. I'm going to try to win again."
2024 - ALL-STAR GAME,February 18,DAMIAN LILLARD,"And I'm going to come into the All-Star Game, my first start, I know I'm going to be on the floor a lot. I'm a vet in the game at this point. Why not go and try to get an MVP? Since I've been here enough."
2024 - ALL-STAR GAME,February 18,DAMIAN LILLARD,"I saw the ball go in, and I started to do that. But I wouldn't say it was validation. It's just something I put my mind on, and that's going to be what my intentions are this weekend, and I was able to do it."
2024 - ALL-STAR GAME,February 18,DAMIAN LILLARD,"I think something could be done about it. I'm not sure what, but I think there's a way to make it a more competitive game. I don't think anybody is going to play in it like it's the playoffs, but it's a way to get guys to come to the table and just play a more solid game, I guess."
2024 - ALL-STAR GAME,February 18,DAMIAN LILLARD,"But I did think it was a good game. Any time the crowd is engaged and you're hearing oohs and aahs and things like that because, if the crowd isn't enjoying what they're seeing, they're not going to say nothing. I've seen it. They'll just sit there and watch."
2024 - ALL-STAR GAME,February 18,DAMIAN LILLARD,"I thought it was enough moments to be excited about and enjoy watching. But it was probably too much leak-out, go get a dunk, go get a layup type of moments. If we could limit those, people wouldn't feel the way they feel sometimes about it, if we could just try to limit it. It's going to happen sometimes, but it probably can't happen as much."
2024 - ALL-STAR GAME,February 18,DAMIAN LILLARD,"I think this is the most success I've probably had in one All-Star Weekend. Had a few launches with some of my partners, won the 3-Point, won the All-Star Game MVP. So it's been a successful weekend. I think any time you get to be a part of this, that's what anybody would want."
2024 - ALL-STAR GAME,February 18,DAMIAN LILLARD,"You want to come here and have success, so I had that. It's just been a good break. Just being around my family, being able to just do the things that I've always done."
2024 - ALL-STAR GAME,February 18,DAMIAN LILLARD,"But going forward, it's just like you've got to recharge and get ready for the closing stretch and try to just get our team to where we need to be so we can go after what we want to accomplish this season."
2024 - ALL-STAR GAME,February 18,LEBRON JAMES,"I think as a kid growing up and loving the game of basketball and watching the NBA All-Star Weekend and seeing the Sunday game, I always had dreams and visions if I was able to play the game at a high level and give everything to the game, hopefully I could be a part of that game someday."
2024 - ALL-STAR GAME,February 18,LEBRON JAMES,It's just been an absolute honor to be able to grace the floor throughout my career and be out there with the greatest players in the world year in and year out.
2024 - ALL-STAR GAME,February 18,LEBRON JAMES,"This is very humbling, very blessed, and it's something I will never forget obviously. It's part of my journey."
2024 - ALL-STAR GAME,February 18,LEBRON JAMES,"That's most important. Yes, I did seek treatment the last few days, trying to get my ankle as strong and as back to where I feel confident that I can finish off this last third of the season."
2024 - ALL-STAR GAME,February 18,LEBRON JAMES,"I won't be playing the entire game tonight, for sure. I can get out there and run around with the young guys for a little bit and then shut it down at some point to give my body, and my ankle more importantly, another opportunity to rest."
2024 - ALL-STAR GAME,February 18,LEBRON JAMES,"I'm seeking some more treatment tomorrow going into this week, because we have quite a few days this week as well. We don't play until the end of the week. See how that goes. But the most important thing for me is definitely my health, where I'm at right now, where our team is leaning. We're trending in the right direction."
2024 - ALL-STAR GAME,February 18,LEBRON JAMES,"Obviously, with our Laker team, it's been about health all year. Trying to do what's best for me for the betterment of the team."
2024 - ALL-STAR GAME,February 18,LEBRON JAMES,"Yes. I think for me, I can affect the game in a lot of ways. At this point in my career, it's still the same way. I can affect the game by being on the ball, being off the ball, cutting from the weak side, slashing from the weak side, running in transition. I have the ability to shoot the ball in space at more frequency at a higher level than I was early in my career. So I've worked on that."
