event,date,person,quote
2024 - WNBA DRAFT,April 15,CELESTE TAYLOR,"Yeah, I started off just being an athletic girl, wanting to play hard, run around. Had a high motor. That kind of took me pretty far. I realized that that was something that was going to get me on the court, doing those little things, taking charges."
2024 - WNBA DRAFT,April 15,CELESTE TAYLOR,"Then once I got to high school, my coach told me if you can guard multiple positions, you know you're going to play. So I think I carried that with me all the time. As I got into college, I started to watch film. I started to watch my opponents and learn different defensive schemes and all that stuff."
2024 - WNBA DRAFT,April 15,CELESTE TAYLOR,"It's been a journey, but it's been a great journey."
2024 - WNBA DRAFT,April 15,CELESTE TAYLOR,"Yeah, I actually am from New York, so I used to go to Liberty games growing up. I was a ball girl a couple times. I've been around the W for a little bit."
2024 - WNBA DRAFT,April 15,CELESTE TAYLOR,"So being able to purchase tickets to sit front row, seeing that, they were giving out free tickets at one point for girls to come in and just have a crowd. To now playing against Iowa and selling out our crowd at home, just to see that evolution and that aspect, and now I haven't been to that many, but I think I went to one of the playoff games with the Liberty last year."
2024 - WNBA DRAFT,April 15,CELESTE TAYLOR,"So just to see that in itself, being a young girl, thinking that the stadium was so huge to coming in there going, you've played in stadiums like this but now it's filled up, it's filled to the top, I think it's great to show people that once you invest in women that they can give back in a lot of ways."
2024 - WNBA DRAFT,April 15,CELESTE TAYLOR,"Yeah, I mean, I didn't. I did not envision this, not because I didn't think I was capable but because I didn't know. I think honestly until I was in maybe about ninth grade, my freshman year of high school, I had to learn the path that it took to get to the W. I was around it, but I didn't know the path that it took to get there."
2024 - WNBA DRAFT,April 15,CELESTE TAYLOR,"Once I learned that these colleges come and you get a free education and you get to experience so many different things -- I've had the opportunity to play on USA teams. So just for me, just understanding everything that comes with it. I didn't expect to be here, but I'm here, and I am so excited that Indiana has taken the opportunity on me."
2024 - WNBA DRAFT,April 15,CELESTE TAYLOR,"I played with Caitlin when I was at USA for a couple years. So we played together there. But from going against her this year to being able to play with her and also Aliyah Boston, as well, it brings me some comfort, honestly."
2024 - WNBA DRAFT,April 15,CELESTE TAYLOR,"Very excited and so proud of what they've done and how they've grown, as well."
2024 - WNBA DRAFT,April 15,CELESTE TAYLOR,"Yeah, it was definitely a tough decision for me last year, but I told people that I would never trade the decision I made to go to Ohio State. I think it has brought me so much peace in who I have become as a player and the impact that I can make in any program that I choose or organization that I have the opportunity to be a part of."
2024 - WNBA DRAFT,April 15,CELESTE TAYLOR,"So just having that mindset and going into Ohio State and coming in and realizing that I can make a little impact, I'm not here to change anything, but I'm just here to sprinkle a little of me in there and try to impact in any way that I can is really helpful."
2024 - WNBA DRAFT,April 15,CELESTE TAYLOR,"Then yeah, playing with Caitlin now is honestly really cool. We've had the opportunity, like I said, to have that sold-out crowd at our place and then going to her place and having that last regular-season home game for them. Just having the opportunity to play with her again, it's going to be amazing. She's done so much for the women's game, and I know she has so much more to give to everyone. Just a lot of excitement."
2024 - WNBA DRAFT,April 15,CELESTE TAYLOR,"Yeah, obviously adaptability is definitely a big thing, being able to go to a different country, adapt to the environment, adapt to the culture. Overseas is definitely a different way to play ball. They play ball pretty differently there. Just having that prior experience. I know there are a lot of people in the W that are from overseas."
2024 - WNBA DRAFT,April 15,CELESTE TAYLOR,"So just having that prior experience, even playing with the caliber of players that I played with, I think all in all, everything together has helped me become the player I am today. I'm very hopeful and very confident that it will help me in the W."
2024 - WNBA DRAFT,April 15,CELESTE TAYLOR,"Yeah, I think pro level of play would probably be the best one. It's just pretty different. They're used to playing against grown women. They're used to that physicality. I think all together it has helped me in many facets of the game of basketball."
2024 - WNBA DRAFT,April 15,CELESTE TAYLOR,"It's really focused on trying to make the team. Obviously that's the first step going into it, and having confidence in myself and trying to make that. If I do, and when I do get the opportunity to play against them, I think it's just going to be such a surreal feeling. I'm there to compete. I'm there to try to make a roster spot. I'm trying to stay in the league."
2024 - WNBA DRAFT,April 15,CELESTE TAYLOR,"I think a lot of it is just excitement, surreal, because I've seen them play. I was younger watching them play. But definitely very competitive and just excitement."
2024 - WNBA DRAFT,April 15,CELESTE TAYLOR,"Yeah, obviously very, very big defensive-minded kid, but at the same time, I'm willing to do whatever it is that a team needs me to do. I'm willing to come in there and impact. I'm really big on community. So just getting my hand in the community and continuing to be who I am and continuing to make an impact in every stop that I've had."
2024 - WNBA DRAFT,April 15,CELESTE TAYLOR,"Yeah, I didn't have the opportunity to really, really get to know her. When I was recruited by Ohio State coming out of high school, she was there. So I got to see her on my visits a couple times. That was probably the biggest interaction. But very hands on, very big about coming to be a Buckeye."
2024 - WNBA DRAFT,April 15,CELESTE TAYLOR,"I think it's kind of interesting that that was the school that I was looking at coming out of high school. I ended up finishing my college career there, and now I get to play with a Buckeye. I think that's also going to give me some comfortability. She's a great player and so much I can learn from her. I'm just ready to go in there to work and continue to learn."
2024 - WNBA DRAFT,April 15,JACY SHELDON,"Yeah, it's special. I think taking that fifth year was something I thought long and hard about and I'm glad I did. A lot of good things came from it. Obviously having Emmy next to me it makes everything easier and that much more special. She's had a huge impact on me and everyone at Ohio State, and it's been really cool to see."
2024 - WNBA DRAFT,April 15,JACY SHELDON,"She's everything to me. She's my why. She's why I do it, why me and my brother work so hard at it. She's special, and I really hope so. I know it'll be a little harder for them to travel, but I feel like absolutely they'll make it to some games."
2024 - WNBA DRAFT,April 15,JACY SHELDON,"Yeah, it's a surreal moment because I grew up as a little kid watching all these women play and how talented they are and being able to have a chance to play with them and compete against them, it's a dream. It's what we all are here for, and it's what we're looking forward to."
2024 - WNBA DRAFT,April 15,JACY SHELDON,"I'm excited. I've seen the growth. Everyone has seen the growth, and to be a part of that is something that is really rare, so I'm looking forward to it."
2024 - WNBA DRAFT,April 15,JACY SHELDON,"Absolutely. I think that's something that's really big in today's world, especially with our class. It's exciting just to have those opportunities as women athletes. I think that's something that is kind of new to us, and it's exciting and it's absolutely something people should take advantage of. To be honest, I'm just ready to go play ball down there right now."
2024 - WNBA DRAFT,April 15,JACY SHELDON,"Yeah, I think there's going to be an adjustment period for all of us, whether people want to admit it or not. I'm looking forward to it and welcoming it. As a rookie I think that's something you have to accept and be ready for."
2024 - WNBA DRAFT,April 15,JACY SHELDON,"The pace, the length, I'm sure there's going to be a lot of things that are a little different and it'll take some time to get used to, but I'm welcoming that challenge and looking forward to it."
2024 - WNBA DRAFT,April 15,JACY SHELDON,"Yeah, I've gotten a lot. I've gotten to spend some time with some vets the past couple days and they've been really helpful. Just staying confident with who you are and what you do well is something that I took from them just a couple days ago. But I think that's important because when you're good at something, you can excel in that area and really keying in on that and taking that with you to the next level is definitely something I'll take from them."
2024 - WNBA DRAFT,April 15,JACY SHELDON,"I'm excited to play with everyone, to be honest on that team. Like I said, I grew up watching them, and I think being able to play with them now and getting that opportunity is something that, like I said, was a dream. They're a really talented group, and I know they're going to push me day one when I get there, so I'm excited for that."
2024 - WNBA DRAFT,April 15,JACY SHELDON,"Competing really against everyone. The league is -- the talent, you guys have seen it and it's no joke and it's something I'm looking forward to and excited for, and like I said, there will be an adjustment, but I'm super excited."
2024 - WNBA DRAFT,April 15,JACY SHELDON,"Yeah, we've had really good discussions. Coach is awesome and just being able to talk about their system and how they like to do things there was awesome for me to learn, and I'm sure I'll be having more conversations soon, but like I said, they've been really good, and I'm looking forward to talking to them more."
2024 - WNBA DRAFT,April 15,JACY SHELDON,"Yeah, I was there for a minute and I got to experience Buckeye Nation and just staying in Ohio, which was amazing. I think just the way we represented that university and the way they're going to continue to, it's an honor to put on that jersey every day, it's an honor to play in front of Buckeye Nation every night. I just hope that we left a legacy of hard work going out there every night and giving it our all."
2024 - WNBA DRAFT,April 15,JACY SHELDON,"As far as representing the university and our fans, I hope we made them proud."
2024 - WNBA DRAFT,April 15,ANGEL REESE,"Jeff Pagliocca, the GM, was amazing, too, and player development is something that I was looking for and they looked for in me. I'm super excited for this move, and I'm just looking forward to getting to Chicago."
2024 - WNBA DRAFT,April 15,ANGEL REESE,"My first time playing Kamilla was on one of the biggest stages in my life, when she played for Hamilton Heights and I played for St. Frances in high school and we battled. Now being able to be teammates is going to be amazing."
2024 - WNBA DRAFT,April 15,ANGEL REESE,"I actually talked to her earlier, was congratulating her. I know she came off an amazing run, an amazing college career. I'm looking forward to playing with her in practice and in games, just bouncing off of each other. So I'm excited for this."
2024 - WNBA DRAFT,April 15,ANGEL REESE,"Okay, so the quote I live by is ""Every day the sun don't shine but that's why I love tomorrows."" Every day the sun don't shine but I love tomorrow. Every day is not going to be a great day and a lot of times in my life I felt like I was down, but I always looked to the next day because I knew something else was great or something greater was going to happen. That's the quote I live by."
2024 - WNBA DRAFT,April 15,ANGEL REESE,I don't know. I don't know what movie right now. I don't know what movie right now.
2024 - WNBA DRAFT,April 15,ANGEL REESE,"Ooh, summertime Chi-town. To be cute on and off the court. I've always been to Chicago. The shopping is great. Just the lifestyle. I'm excited. I feel like I'm a Chi-town girl."
2024 - WNBA DRAFT,April 15,ANGEL REESE,Something Megan Thee Stallion. I love Megan Thee Stallion. Megan Thee Stallion or Beyonce.
2024 - WNBA DRAFT,April 15,ANGEL REESE,"I have had so many people reach out to me from so many different places. Understanding our impact isn't just within our school, within just the U.S., but it's worldwide. It's amazing to see."
2024 - WNBA DRAFT,April 15,ANGEL REESE,"Going out of the country when we go out of the country with my team, with LSU, it was like so much fun because they all recognized us and they knew us and it felt like home. I feel like anywhere we all go, and this draft class is amazing, anywhere we go, we're known. This is super cool because women aren't usually recognized around the world like how we are, and it's not even just basketball. It's the impact we've left on people's lives outside of there. It's super cool to see."
2024 - WNBA DRAFT,April 15,ANGEL REESE,"I think our duo, me and Kamilla versus Cam and Rickea is going to be cool to see. That's going to be fun."
2024 - WNBA DRAFT,April 15,ANGEL REESE,"Just be you. A lot of people may just tell you that you can't do certain things, and you're going to get more yeses and nos, and I had to realize that. Just being able to be authentic, and people love me because of who I am. I had those tough conversations. I say things that a lot of people are scared to say, and take that scary step. I took a scary step of faith going to LSU, not knowing what could happen, and look how my life has completely changed."
2024 - WNBA DRAFT,April 15,ANGEL REESE,"Being able to just believe in yourself, trust in yourself and have an amazing team behind me is great."
2024 - WNBA DRAFT,April 15,ANGEL REESE,"I mean, I didn't know what I was going to do. Obviously coming back would have been amazing for me, but I wanted more for myself. I wanted to start over. I feel like I had been at a high since the National Championship, and I want to hit rock bottom. I want to be a rookie again. I want to be knocked down by vets, and I want to be able to get up and grow and be a sponge."
2024 - WNBA DRAFT,April 15,ANGEL REESE,"I'm just super excited to play with the amazing players and against amazing players. This league is really competitive and I'm a competitive player, so I want to play against a lot of great players."
2024 - WNBA DRAFT,April 15,ANGEL REESE,"Well, my mom was crying before the show even started, so it started there. Then my brother was like agitating me, I bet you 100 that you cry, I bet you 100 that you cry. He kind of got me, too. And I had a great conversation, like she was saying, with Chicago, so I kind of knew -- if it wasn't the Mystics, I knew it was going to be Chicago that was going to be calling me home."
2024 - WNBA DRAFT,April 15,ANGEL REESE,"It means everything. I mean, like I said, on and off the court, we're amazing. We're not just basketball players, we're super impactful to the community, the people around us, the little kids that look up to us, and being able to also be nationwide, everybody knows us everywhere we go. Our lives aren't normal. We might get a little bit of normalcy going into the league now, but I'm just excited to be a trailblazer. I'm excited to be a part of history, and just continue to see the future, and I know it's bright."
2024 - WNBA DRAFT,April 15,NYADIEW PUOCH,"Yeah, it's huge. Obviously traveling from the other side of the world or from Australia, it's a lot. Like I'm still jet-lagged and everything. I've still got emotions running through and I can barely sleep. But it's great."
2024 - WNBA DRAFT,April 15,NYADIEW PUOCH,"It's great to just look back, knowing that my country back home, my family and my friends they're all proud of me and they're all supporting me, watching me, especially my mom. She's done so much for me, my family and stuff, making sacrifices for us. Growing up I didn't come from a big basketball sporty world, and just played it because I loved it and my siblings played it, and then to get where I am now, it's incredible."
2024 - WNBA DRAFT,April 15,NYADIEW PUOCH,"Obviously being in Australia, it's a bit difficult to watch the games and get to it and stuff, but I think as the years progressed, we started getting to know the game a bit more and obviously it's like a little sisterhood. We've got the WNBL now on our side and we've got the WNBA, so you get to know about it. And we've got Australians and grads that play in the WNBA, as well, so then you get to study that, as well."
2024 - WNBA DRAFT,April 15,NYADIEW PUOCH,"Yeah, well, growing up in juniors, I'd always be the scorer, attacking the rim, being an offensive player and stuff. But as I headed into the pro league, being young, there's already people doing all that. You have to make sacrifices. You need to learn the game a bit more, learn your other strengths. For me, it was defense. My length, being able to guard different positions, different players, being able to switch on to different people and just using my length, my ability, my quickness to kind of get around people."
2024 - WNBA DRAFT,April 15,NYADIEW PUOCH,"For me, I think when I play defense and I play great defense, it brings my offense naturally. So it's like, it just comes to me, and I don't have to force anything. So that's probably why I do that."
2024 - WNBA DRAFT,April 15,NYADIEW PUOCH,"I'm very excited. Obviously playing in a different league and then coming into another one is great. The lifestyle, the people you play against, what we learn in the game here is obviously a bit different, so getting to learn that, playing against people, taking things from them, what I can add into my game."
2024 - WNBA DRAFT,April 15,NYADIEW PUOCH,"All of them. All the WNBA players. It's so different back home. Again, like in the WBNL we do have imports that come and play, we had Tiffany Mitchell, Jordin Canada and being able to play against them and with them is huge, no matter whether they're guards or bigs, just playing against all of them and seeing the differences in how they all play and just -- yeah."
2024 - WNBA DRAFT,April 15,NYADIEW PUOCH,"I think it's amazing. Like I haven't been there before, but stories, everything I've heard about it, we've got fellow Aussies over there, as well. We've got Paul Goriss that's also there, as well, and he's been good to me, as well. He's talked to me then and there. He's been texting me and stuff, and Kristy Wallace. She's amazing, as well, on the court and off the court, as well."
2024 - WNBA DRAFT,April 15,NYADIEW PUOCH,"But I think just getting to know everyone, getting the experience, the new lifestyle and just -- as well as the coaches and the staff and everything."
2024 - WNBA DRAFT,April 15,NYADIEW PUOCH,"I think it's cool. It's amazing seeing fellow Australians in the WNBA, and they're achieving what you're achieving, as well. It's a privilege, honestly. It's such a great thing, and it's like -- I feel like it's just good that people can look at it and be like, wow, these Australians can play because I feel like that's one thing we don't really get sometimes, and we've had people like Lauren Jackson providing that for us."
2024 - WNBA DRAFT,April 15,NYADIEW PUOCH,"I hope one day we can leave that kind of legacy to younger kids and everyone, as well, in this generation, as well."
2024 - WNBA DRAFT,April 15,NYADIEW PUOCH,"I'm not really having any expectations. Just going in there with an open mind, making sacrifices. It's going to be hard. I'm young. They're great professional players, talented athletes. It's going to be hard, and I'm coming from a different country, different environment and a new lifestyle."
2024 - WNBA DRAFT,April 15,NYADIEW PUOCH,"Just taking it day by day, learning experience, talking to the vets, talking to everyone around there and just building that on to my game."
2024 - WNBA DRAFT,April 15,ALISSA PILI,"I think it's great because I could do both, and either spot they need me to play that I could just sharpen in that area and get really good and just excel."
2024 - WNBA DRAFT,April 15,ALISSA PILI,"Yeah, I'm super excited to come in and just learn from players like that. I think that's the fun part about it is we think we've been playing for so long, we know a lot about the game, but there's so much more to learn. I'm just looking forward to that."
2024 - WNBA DRAFT,April 15,ALISSA PILI,"I think that I just bring versatility and just a physicality to the game of basketball, and so that's what mostly they'll be seeing from me."
2024 - WNBA DRAFT,April 15,ALISSA PILI,"Yeah, I think just my teammates and how much time we spent together. I think that's something I'll miss, all the memories and things like that."
2024 - WNBA DRAFT,April 15,ALISSA PILI,"Definitely the community in Salt Lake City. I think it's really grown on me the last two years I was there, and I'm going to miss it a lot because even though I came from another Pac-12 school, they still took me with open arms and just supported me throughout everything."
2024 - WNBA DRAFT,April 15,ALISSA PILI,I'm just looking forward to just starting this new journey and hopefully having a great rookie season.
2024 - WNBA DRAFT,April 15,ALISSA PILI,Just that I'm a humble person and somebody who is really for the community and just loves to represent my people. I think I just especially this year just try to tap into representing my culture and just being that inspiration for young kids who look like me and are of my same background.
2024 - WNBA DRAFT,April 15,ALISSA PILI,"I just think that impact is something that I'll carry with me to the WNBA, and I just hope that's what people see."
2024 - WNBA DRAFT,April 15,ALISSA PILI,"Yeah, I have a little bit. Gianna and Jenna have talked about Minnesota a lot and just how it is a very basketball-oriented state, and there's been so much rich culture of that there. So I'm excited to see it and experience it."
2024 - WNBA DRAFT,April 15,ALISSA PILI,"Yeah, I think they'll just get somebody who's a competitor and somebody who has a unique style of play and is just fun to watch."
2024 - WNBA DRAFT,April 15,ALISSA PILI,I'm very excited to just be able to play at the next stage and kind of just improve in areas that I need to to really excel at the next level.
2024 - WNBA DRAFT,April 15,ALISSA PILI,"Yeah, growing up in Alaska was great. I would say I loved my childhood. It was just so much fun, camping, fishing, doing a bunch of outdoor stuff, and it's a beautiful state. The only problem I think was just the isolation it had from the rest of the world, and how much it lacked exposure and just sports and things like that. But I wouldn't have had it any other way. I loved my state and carry that with a lot of pride."
2024 - WNBA DRAFT,April 15,ALISSA PILI,"I know going to Minnesota the cold probably won't bother me since I'm used to that, but I'm excited to be in a new environment and place."
2024 - WNBA DRAFT,April 15,ALISSA PILI,"The football question, that's just played a big part in my life, I think, just kind of building up the physicality I played with. It's helped me a lot with that. Just having an older brother, he plays for the Dolphins now, just kind of looking back on it, how we were literally on the same team and competing against each other, it's cool to see."
2024 - WNBA DRAFT,April 15,ALISSA PILI,"We're both very fortunate to be doing what we love at the highest level, and it's just a blessing."
2024 - WNBA DRAFT,April 15,CHARISMA OSBORNE,"Yeah, first, I'm super excited to be drafted to Phoenix. I know they have some really amazing players there."
2024 - WNBA DRAFT,April 15,CHARISMA OSBORNE,"But yeah, I think I'm super motivated. Obviously since being a kid I've always wanted to play in the WNBA. To have this opportunity means the absolute world to me, and I'm just excited to go out to Phoenix and get started."
2024 - WNBA DRAFT,April 15,CHARISMA OSBORNE,"I'll definitely miss the people. I love my teammates, my coaches and the staff around there, and them helping me so much. I know that in the dub I'll be a little bit more independent, so I'll probably miss the extra help of people telling me what to do. But I'm excited for what's next."
2024 - WNBA DRAFT,April 15,CHARISMA OSBORNE,"I know at some point I have to grow up, so..."
2024 - WNBA DRAFT,April 15,CHARISMA OSBORNE,"Yeah, I think it really was. I think I learned so much about myself as a player and especially as a leader. We had a really young team this past year, and I felt like I was able to grow my game and my leadership. I loved playing with my teammates and they always challenged me to be better, but I definitely think any leadership. I used to be so shy as a kid, so to see where I am now, I'm just so proud of that."
2024 - WNBA DRAFT,April 15,CHARISMA OSBORNE,"Yeah, I'm so excited to learn from both of them. Obviously they have a lot of great guards there, and Diana Taurasi is like the GOAT of basketball, so to be able to learn from her is going to be so fun and I can't wait for that. Natasha Cloud, I love her energy. I love when she used to play for Mystics and she was so fun to watch."
2024 - WNBA DRAFT,April 15,CHARISMA OSBORNE,It's kind of unreal to be able to say that like I'm going to be teammates with Diana Taurasi and Natasha Cloud.
