event,date,person,quote
2024 - WNBA FINALS: MINNESOTA VS. NEW YORK,October 16,BREANNA STEWART,"They were up and their shots weren't falling. We were getting good looks, and it's like, if we are going to be this close, we are not leaving here without this win. It's tough to play in this arena, but the way that we continued to stay together is something that I'm not shocked at but I am really proud of."
2024 - WNBA FINALS: MINNESOTA VS. NEW YORK,October 16,BREANNA STEWART,I was mad we were losing.
2024 - WNBA FINALS: MINNESOTA VS. NEW YORK,October 16,BREANNA STEWART,"We know we're one game away from winning the championship, and I think that they are going to give us their best shot. They are going to give everything they have got, and you know what, so are we. The turnaround is quick but we are going to continue to be ready. There's a lot of things that we didn't do right tonight and have a kind of quick memory. I think that we're happy we got this win but we're -- the job's not done."
2024 - WNBA FINALS: MINNESOTA VS. NEW YORK,October 16,SABRINA IONESCU,"Yeah, I just went up and gave him a big shot. Him and Jodie Berry, our assistant coach came down and he kind of told me the same thing, like there was never a doubt."
2024 - WNBA FINALS: MINNESOTA VS. NEW YORK,October 16,SABRINA IONESCU,"Obviously him, Sandy, all the coaches that I've had, just their continued belief and pouring into me means the world to me whether I make or miss that shot. Like the fact that they kind of trusted me to go out there and make big shots, that's why I love playing for this team and continue to pour my all."
2024 - WNBA FINALS: MINNESOTA VS. NEW YORK,October 16,SANDY BRONDELLO,"It's pretty special. It was never in doubt. Obviously Stewie got us back in there, willed us in there, but I thought the right time, this is Sabrina. She just made a big shot. She's a great shooter and she just needed a little bit of separation."
2024 - WNBA FINALS: MINNESOTA VS. NEW YORK,October 16,SABRINA IONESCU,"Definitely the biggest shot of my career, and yeah, I mean, I would say like I visualize a lot when I'm practicing in the off-season, the night before a game, the day of a game. Like I'm always visualizing different scenarios, and putting myself in tough situations. Like obviously I didn't play my best tonight, but finding a way to continue to stick with it, and I feel like that's been a big growth for me, whether the ball is going in or not."
2024 - WNBA FINALS: MINNESOTA VS. NEW YORK,October 16,SABRINA IONESCU,"Yeah, definitely the biggest shot of my career and hopefully not the last."
2024 - WNBA FINALS: MINNESOTA VS. NEW YORK,October 16,BREANNA STEWART,It did. Pretty nice.
2024 - WNBA FINALS: MINNESOTA VS. NEW YORK,October 16,BREANNA STEWART,"Not for us. I think that, you know, this feels like we're playing on their home court, and I feel like each game is so different. You know, you go from 1 to 2 to 3. But the way that we continue to fight and be resilient. I don't want to speak for you guys. Doesn't feel like Game 1 to me. Feels like Game 3."
2024 - WNBA FINALS: MINNESOTA VS. NEW YORK,October 16,BREANNA STEWART,"At this point, I don't know."
2024 - WNBA FINALS: MINNESOTA VS. NEW YORK,October 16,BREANNA STEWART,"I think -- well, I think the way that we fought back in the second, knowing that our offense didn't really click yet but we were able to limit them defensively. But then in the third, when we had a strong push, a strong punch. You guys know the first two games, our third quarters have been a struggle to score offensively."
2024 - WNBA FINALS: MINNESOTA VS. NEW YORK,October 16,BREANNA STEWART,"We were getting downhill. We were attacking and we were being confident. If a mistake happened, like a turnover or a missed shot or like something just doesn't go our way, we didn't panic. We continued to play and continued to fight through it because we know how big this moment is. We have the experience of the good, bad, ugly, and different."
2024 - WNBA FINALS: MINNESOTA VS. NEW YORK,October 16,SANDY BRONDELLO,"Yeah, we didn't come out how we wanted to start the game. We knew they'd threw the first punch. I thought we weren't playing how we wanted to play physically, mentally with the pace and everything. But credit to them. They were taking us out of stuff that we wanted to do and they were making big shots."
2024 - WNBA FINALS: MINNESOTA VS. NEW YORK,October 16,SANDY BRONDELLO,"I trust this team. I feel like we've grown so much. We've handled adversity even from Game 1, you know what I mean? It's like, okay, this is a totally different game here and we just had to chip away."
2024 - WNBA FINALS: MINNESOTA VS. NEW YORK,October 16,SANDY BRONDELLO,"I did. I felt confident. Even with that last shot I felt confident, okay, because we worked hard and we found a way to win."
2024 - WNBA FINALS: MINNESOTA VS. NEW YORK,October 16,BREANNA STEWART,"Yeah, I think that what the big three means is between Sab, JJ and myself, we know when it's our time to step up and to make an impact. And over the course of the game, it's like sometimes things are hard. Sometimes things are frustrating. I pick up two fouls in the first quarter. But knowing that our team trusts and believes in us to be in this position to take these shots, to help get the game in the right place, but at the same time we wouldn't be here without our teammates, and having that trust and belief just gives us confidence."
2024 - WNBA FINALS: MINNESOTA VS. NEW YORK,October 16,BREANNA STEWART,"I don't know. Like, you guys talk about the run, Sab's shot. There was so many players that came in that were like such an important piece of what we were able to do tonight just because they made Minny tired and that's what makes this team really special. It's a collective win even though some of us are shining a little bit brighter."
2024 - WNBA FINALS: MINNESOTA VS. NEW YORK,October 16,SANDY BRONDELLO,Thank you.
2024 - WNBA FINALS: MINNESOTA VS. NEW YORK,October 16,SABRINA IONESCU,"Yeah, I think it's important to just read the game, and being able to get downhill and find JJ on a really important basket that, helped us late in the game. Because you're just not really one-dimensional. The defense doesn't know what you're going to do Are you going to shoot it are you going to pass it? Are you going to be a screener, a decoy? There's just so many opportunities that when you have the gravity we have to be able to make it tough on the defense."
2024 - WNBA FINALS: MINNESOTA VS. NEW YORK,October 16,SABRINA IONESCU,"JJ was huge for us. The way that she protected the rim, hit a huge three, hit that layup, like just continue to go chip away, and it was a total team effort. Like Stewie said, we're not here without every single person on this team."
2024 - WNBA FINALS: MINNESOTA VS. NEW YORK,October 16,SABRINA IONESCU,Just in the locker room waiting on Stewie. I would say I really didn't realize how far out I was.
2024 - WNBA FINALS: MINNESOTA VS. NEW YORK,October 16,SABRINA IONESCU,"Yeah, like I kind of, you know, wasn't sure if I was dribbling with my right or left hand and then I was like, oh, yeah, I did hit that step-back."
2024 - WNBA FINALS: MINNESOTA VS. NEW YORK,October 16,SABRINA IONESCU,"But I just didn't really realize how far I was, but like I said, it's a shot that I take often and I take in practice and that I take before the game. It's not like a Hail Mary, hope this goes in. It's like, once I got it off, I was like, yeah, this is in."
2024 - WNBA FINALS: MINNESOTA VS. NEW YORK,October 16,SANDY BRONDELLO,"Yeah, I was really, really happy with Nyara. It was the plan to give her a few more extra minutes tonight. Stewie came in a little sooner because Stewie got two fouls early."
2024 - WNBA FINALS: MINNESOTA VS. NEW YORK,October 16,SANDY BRONDELLO,"She played so hard. She was winded by the end of those seven minutes. We played her seven minutes in a row but she was so effective. Just the ability, they were being so aggressive, and what Nyara brings is she's always on her front foot getting downhill. She's always going to run the floor, just a hundred miles an hour, which is what we needed."
2024 - WNBA FINALS: MINNESOTA VS. NEW YORK,October 16,SANDY BRONDELLO,"So it's been great to see her growth, and yeah, it was never in doubt there. But obviously I went to Slooty early, too, and I thought that changed the pace of the game. We struggled a little bit. Not often do I sit both of these at the same time, very rarely. But I felt like we needed to at that moment, and I think they gave us really good energy."
2024 - WNBA FINALS: MINNESOTA VS. NEW YORK,October 16,SANDY BRONDELLO,"We got it back to ten after that first quarter, and I think that was the thing. We've got to keep grinding, keep grinding, and as the game went on, we got back to playing Liberty Basketball."
2024 - WNBA FINALS: MINNESOTA VS. NEW YORK,October 13,CHERYL REEVE,"Our offense was bad at a time when we really needed it. Our pace was slow. Taking too long to get into things, and you know, I don't think we were terribly hard to play against from that standpoint. And that was obviously a difficult time to be doing that."
2024 - WNBA FINALS: MINNESOTA VS. NEW YORK,October 13,CHERYL REEVE,"I'm disappointed that we let it get to 17. I'm more disappointed in that. I'm more than disappointed, I'm pissed that that happened again."
2024 - WNBA FINALS: MINNESOTA VS. NEW YORK,October 13,CHERYL REEVE,"Sure, did."
2024 - WNBA FINALS: MINNESOTA VS. NEW YORK,October 13,NAPHEESA COLLIER,It's hard. You have to adjust to the refs. Definitely it's not an excuse. We played really bad. I'm definitely not using that as an excuse.
2024 - WNBA FINALS: MINNESOTA VS. NEW YORK,October 13,NAPHEESA COLLIER,But it's hard to adjust because you are playing one way and you are getting used to the refs and then they change it up. But that's not why we lost. It wasn't them. It was us. Can't blame that.
2024 - WNBA FINALS: MINNESOTA VS. NEW YORK,October 13,CHERYL REEVE,It's been talked about a lot. This is a group that problem solves well together. They never think they are out of it. Their belief in themselves and their belief in each other is top-notch. And we know it's a long game. They are very experienced.
2024 - WNBA FINALS: MINNESOTA VS. NEW YORK,October 13,CHERYL REEVE,"We just knew what we had to clean up, get some things cleaned up and we did that then. Put ourselves in position, right where we wanted to be and just couldn't get over the hump."
2024 - WNBA FINALS: MINNESOTA VS. NEW YORK,October 13,CHERYL REEVE,"I don't think it affected the game. I don't know if it affected her play. Phee can answer that. It was a chance to get her three minutes of rest and at the end of the quarter, that was fine, and then she went back in."
2024 - WNBA FINALS: MINNESOTA VS. NEW YORK,October 13,CHERYL REEVE,So it didn't affect us.
2024 - WNBA FINALS: MINNESOTA VS. NEW YORK,October 13,CHERYL REEVE,"Huge difference. So both games they have gotten help from part of their -- they have a big five, right, their starters are all very capable, just like our starters are all very capable and you need players beyond your stars, and for two games, they have done that. We're having trouble getting that consistently and we've got to have that."
2024 - WNBA FINALS: MINNESOTA VS. NEW YORK,October 13,NAPHEESA COLLIER,"I mean, yeah, obviously you want to steal one on the road. We're really disappointed I think in how we played today but excited to go home and play in front of our crowd, and we have to respond. We have to come out playing better than we did in these two games."
2024 - WNBA FINALS: MINNESOTA VS. NEW YORK,October 13,NAPHEESA COLLIER,"It's hard. Like we are both competing for a championship. You have to play with a level of desperation from the very beginning, and so that's what we're going to need to do to come out in Game 3."
2024 - WNBA FINALS: MINNESOTA VS. NEW YORK,October 13,NAPHEESA COLLIER,I honestly don't feel like I changed my mindset. I feel like I stayed aggressive on defense. I was frustrated that I had those four fouls but I don't think it affected me in the way that I was playing.
2024 - WNBA FINALS: MINNESOTA VS. NEW YORK,October 13,CHERYL REEVE,"No, I happen to agree with you. I had a chance to talk to Joe Ingles, I don't know if I told Lan this when we were in Minnesota, and he asked me how I liked my Australian. And we talked about all the ways that we love the way that Lan plays and her level of compete, and that's what Joe said. He's like, one thing you're darned sure an Australian is going to do is compete their tails off."
2024 - WNBA FINALS: MINNESOTA VS. NEW YORK,October 13,CHERYL REEVE,"And Lan is the very definition of that. Doesn't matter how big, doesn't matter how difficult it is. Lan is always there for us in that way."
2024 - WNBA FINALS: MINNESOTA VS. NEW YORK,October 13,CHERYL REEVE,"We were trying to get another ball handler out there, somebody they had to pay attention to, try to get downhill a little bit, try to create some easier opportunities playing with flow. Setups weren't necessarily producing anything for us, so we just thought, spread the floor and play with two ball handlers."
2024 - WNBA FINALS: MINNESOTA VS. NEW YORK,October 13,CHERYL REEVE,"Well, I mean, what did she have at half, 12? Ten of them were in fast break. Ten of them were fast break. So what changed is she wasn't able to get it in the fast break and we had her in the halfcourt."
2024 - WNBA FINALS: MINNESOTA VS. NEW YORK,October 13,CHERYL REEVE,I think Stewie is the same. I don't think making her missing a shot or free throw. We do this long enough that those things happen. She's resilient. She played exactly like we thought she would. I thought she played great in Game 1.
2024 - WNBA FINALS: MINNESOTA VS. NEW YORK,October 13,CHERYL REEVE,"And so you know, I think her impact defensively was something that we felt. You know, what did she have, seven steals? And so you know, she's been doing that in these playoffs."
2024 - WNBA FINALS: MINNESOTA VS. NEW YORK,October 13,CHERYL REEVE,"More than that, in my mind -- you have to ask Stewie, but I don't think that's what was on her mind. I think what was on their collective minds is it's a must-win game for them and they came out and played like it was, and they took the game."
2024 - WNBA FINALS: MINNESOTA VS. NEW YORK,October 13,CHERYL REEVE,"Yeah, but I think the opponent has a fair amount to do with it. We have to come up with better opportunities and better things that we can do offensively so that we can get back to a little bit more of a balanced scoring."
2024 - WNBA FINALS: MINNESOTA VS. NEW YORK,October 13,CHERYL REEVE,So I think that's most important to say is New York has had a lot to do with this.
2024 - WNBA FINALS: MINNESOTA VS. NEW YORK,October 13,CHERYL REEVE,"You've got players that are playing a lot of minutes, a lot of heavy minutes, and any time you can get your bench to come in and be productive and you can keep them out there longer, that's an advantage."
2024 - WNBA FINALS: MINNESOTA VS. NEW YORK,October 13,CHERYL REEVE,"But I don't think either bench has been necessarily a separator. We talked about Hiedeman in the last game. She scored it. I think she had ten, right. So that was impactful."
2024 - WNBA FINALS: MINNESOTA VS. NEW YORK,October 13,CHERYL REEVE,"But you know, both teams are looking for anywhere else you can go so that you don't have all this pressure on your top players."
2024 - WNBA FINALS: MINNESOTA VS. NEW YORK,October 13,BREANNA STEWART,"What we continued to keep saying to one another was like stay together, keep playing. Every rebound matters. And even if our offense gets a little bit stagnant and funky, we are not going to let that dictate what we do defensively."
2024 - WNBA FINALS: MINNESOTA VS. NEW YORK,October 13,SANDY BRONDELLO,"Yeah, massive. They have been going under on screens so we encouraged her to shoot the three. She's a great three-point shooter. She was stroking it yesterday in practice before the game."
2024 - WNBA FINALS: MINNESOTA VS. NEW YORK,October 13,SANDY BRONDELLO,"Yeah, she was digging deep and that's what we needed. We knew we needed to bounce back and it was a big bounce-back game. They contained Leonie a little bit after what she did in Game 1 but B helped us get this margin to win the game."
2024 - WNBA FINALS: MINNESOTA VS. NEW YORK,October 13,BREANNA STEWART,"Absolutely. Just like not letting history repeat itself and knowing that Game 1 happened but now, you know, how can we control Game 2 and I think that honestly the thought process was, we were trying to be up a little bit more. Like not letting them get to the three-point line to set up their offense. And then in to out, whether I'm helping, I know that Sab or whoever else is helping on my backside, and making them have to move just a little bit quicker than they want to."
2024 - WNBA FINALS: MINNESOTA VS. NEW YORK,October 13,BREANNA STEWART,"No. Honestly -- sorry, I'll just rant laughter."
2024 - WNBA FINALS: MINNESOTA VS. NEW YORK,October 13,BREANNA STEWART,"I kind of texted him and I was like, you know what it's about time that you come to my game. I've been here for two years and he hasn't come down. What are you doing? Yeah, CD Dailey came and she got that same message, too."
2024 - WNBA FINALS: MINNESOTA VS. NEW YORK,October 13,SANDY BRONDELLO,It's a long drive.
2024 - WNBA FINALS: MINNESOTA VS. NEW YORK,October 13,BREANNA STEWART,Two hours.
2024 - WNBA FINALS: MINNESOTA VS. NEW YORK,October 13,BREANNA STEWART,"I think what B brings is this grit, this toughness, knowing that -- and all of us know, she's giving us whatever she's got, and the way that she continued to be aggressive, they were going under on her and she knocked that thing down with confidence, got into the paint, drive and kicks."
2024 - WNBA FINALS: MINNESOTA VS. NEW YORK,October 13,BREANNA STEWART,But that's what we're used to. We know she can do this and happy to see her get into a good rhythm with everything that's been up and down this season and know that she's a big factor in everything we do.
2024 - WNBA FINALS: MINNESOTA VS. NEW YORK,October 13,BREANNA STEWART,"Absolutely. I think that the first thing was higher pick-up points, knowing that if Leo was going to be up, really trying to limit Courtney Williams, then I need to be there, too. So when Phee is dribbling up it's without any pressure."
2024 - WNBA FINALS: MINNESOTA VS. NEW YORK,October 13,BREANNA STEWART,"Obviously knowing her tendencies. She wants to go left, she wants to go over the right shoulder. She's going to pump fake a million times. So just staying down and making her continue to take tough shot that she doesn't want to take."
2024 - WNBA FINALS: MINNESOTA VS. NEW YORK,October 13,SABRINA IONESCU,"That's really what my goal was, was just take what the defense gives me and not forcing anything but understanding I'm going to be able to drive and kick. And players hit, multiple players hit really big shots. But obviously I think coming out like that was great for us to get going."
2024 - WNBA FINALS: MINNESOTA VS. NEW YORK,October 13,SABRINA IONESCU,"And then in the second half, they made some adjustments and I think it was understanding being able to drive passing lanes and find the open man, if they are going to bring a few on the ball."
2024 - WNBA FINALS: MINNESOTA VS. NEW YORK,October 13,SABRINA IONESCU,So I just did that. I don't always need to be looking to score every single time I have the ball. Just continue to make the right read and understanding what it is that provides our best offense as a team.
2024 - WNBA FINALS: MINNESOTA VS. NEW YORK,October 13,SANDY BRONDELLO,"I think everyone has seen her. She's been struggling but she's been feeling good these last few days, can tell you that much. She has been."
2024 - WNBA FINALS: MINNESOTA VS. NEW YORK,October 13,SANDY BRONDELLO,"We just knew it was a bit of time. We've given her so much rest here and she was ready to go. She puts the work in. Like I said, she's tough. We talked about the grittiness that she gives us."
2024 - WNBA FINALS: MINNESOTA VS. NEW YORK,October 13,SANDY BRONDELLO,"But it's great that you put the ball in her hand and be more of a playmaker, because it takes a little bit more pressure off these two in particular. I thought that was very effective for us. But her defense, she was everywhere. She was guarding everyone. I'm really happy for her. We just have to freshen up and get ready for the next game."
2024 - WNBA FINALS: MINNESOTA VS. NEW YORK,October 13,BREANNA STEWART,"I think what B and I were continuing to say in the huddles was defensively, you know, the schemes because they went small. So it means our matchups are a little bit different. And making sure that we have each other's help. If we are weak side, who is high, who is low. Just those type of things, and knowing that like scores and stops, we're playing the long game in the last two minutes, and making sure that we are all are on the same page."
2024 - WNBA FINALS: MINNESOTA VS. NEW YORK,October 13,SANDY BRONDELLO,"Look, I mean, I think we missed her grittiness and just she's the ultimate competitor. She takes pride -- she used to always guard the best player and obviously now we have Leo, too, that makes us really a versatile defensive team."
2024 - WNBA FINALS: MINNESOTA VS. NEW YORK,October 13,SANDY BRONDELLO,"But you also miss her play-making. That's something we talked about this year. We wanted to make sure she could play-make more and it was hard for to play-make when she was hobbling around with the knee. We need her to get confidence first, and then to go out and play."
2024 - WNBA FINALS: MINNESOTA VS. NEW YORK,October 13,SANDY BRONDELLO,"She's just impactful because she plays at both ends of the floor, and plays hard, and she's a winner. So happy that she got the success tonight and keep building on it."
2024 - WNBA FINALS: MINNESOTA VS. NEW YORK,October 13,SANDY BRONDELLO,"Well, I'm not from here."
2024 - WNBA FINALS: MINNESOTA VS. NEW YORK,October 13,SANDY BRONDELLO,"Geno. Vivian, has been here for B. It's great."
2024 - WNBA FINALS: MINNESOTA VS. NEW YORK,October 13,SANDY BRONDELLO,It's a full house tonight. It was really loud.
2024 - WNBA FINALS: MINNESOTA VS. NEW YORK,October 13,BREANNA STEWART,Largest crowd ever.
2024 - WNBA FINALS: MINNESOTA VS. NEW YORK,October 13,BREANNA STEWART,SANDY BRONDELLO Loudest.
2024 - WNBA FINALS: MINNESOTA VS. NEW YORK,October 13,BREANNA STEWART,BREANNA STEWART Largest.
2024 - WNBA FINALS: MINNESOTA VS. NEW YORK,October 13,BREANNA STEWART,SANDY BRONDELLO Largest.
2024 - WNBA FINALS: MINNESOTA VS. NEW YORK,October 13,BREANNA STEWART,She's not from here.
2024 - WNBA FINALS: MINNESOTA VS. NEW YORK,October 13,SANDY BRONDELLO,I'm not from here. Loudest? Largest.
2024 - WNBA FINALS: MINNESOTA VS. NEW YORK,October 13,SANDY BRONDELLO,"I'm not from here. It's great. We talked about the winner is women's basketball, WNBA. So many fans coming out to watch these amazing players play, but yeah, they are all welcome. All coaches."
2024 - WNBA FINALS: MINNESOTA VS. NEW YORK,October 13,SABRINA IONESCU,My coach is coming to Minnesota.
2024 - WNBA FINALS: MINNESOTA VS. NEW YORK,October 13,SANDY BRONDELLO,Okay. Kelly is coming.
2024 - WNBA FINALS: MINNESOTA VS. NEW YORK,October 13,SANDY BRONDELLO,SABRINA IONESCU Go Ducks.
2024 - WNBA FINALS: MINNESOTA VS. NEW YORK,October 13,BREANNA STEWART,"Absolutely. I think the moment the game ended Thursday night, I was looking forward to Sunday, just to be able to kind of change things, change the narrative a little bit, and know that I'm going to come out and be the same that I was and be obviously better."
2024 - WNBA FINALS: MINNESOTA VS. NEW YORK,October 13,BREANNA STEWART,"But throughout this entire process, my team has my back every step of the way and was just excited to have another opportunity to go to battle with them. Because we have a lot of fun in everything that we do, and you know, it's not always like that."
2024 - WNBA FINALS: MINNESOTA VS. NEW YORK,October 13,BREANNA STEWART,"It was the difference in this last game. I think that especially after watching the film of Game 1, we slowed down to a pace that is a little bit awkward for us. We want to play fast and we want to move the ball and we want to get downhill and we want to score, obviously."
2024 - WNBA FINALS: MINNESOTA VS. NEW YORK,October 13,BREANNA STEWART,"So making sure that no matter what, we continue to play fast, we get good shots and we get that defense moving."
2024 - WNBA FINALS: MINNESOTA VS. NEW YORK,October 13,SABRINA IONESCU,"Understanding how teams are playing me and being able to make that adjustment in real time. Possession by possession, quarter by quarter, teams have kind of changed the way they have guarded, whether they are switching, hedging, trapping. And I think being able to just be poised and understanding what it is that I need to do in order to create an advantage for the team that we have out there on the floor is what I've always wanted to do, and I feel like I've been able to do that in a really good spot."
2024 - WNBA FINALS: MINNESOTA VS. NEW YORK,October 13,SABRINA IONESCU,Obviously my teammates set really good screens and are able to get me open in order for me open to create for them.
2024 - WNBA FINALS: MINNESOTA VS. NEW YORK,October 13,SABRINA IONESCU,"I'd say it worked pretty well for us, understanding that we use our big lineup and knowing that, you know, we can get the ball inside. We can switch. We're able to apply pressure defensively with our length and being able to get steals and just disrupt their flow."
2024 - WNBA FINALS: MINNESOTA VS. NEW YORK,October 13,SABRINA IONESCU,"But obviously it's a series and it's a chess match and they are going to throw different adjustments, and I think our ability to stay poised and being able to kind of see what it is that they are doing in real time is going to be crucial."
